{
  "title": "Coca-Cola",
  "date": "2025-01-24",
  "price": "Set USD 239.94 / Box USD 39.99",
  "body": "Identity \\& taxonomy:\nBrand: POP MART.\nLine: The Monsters x Coca-Cola.\nCharacter: Labubu \\& Zimomo.\nSeries: Coca-Cola.\nProduct title: THE MONSTERS Coca-Cola Series – Vinyl Face Blind Box.\nVariant name: 10 standard figures + 1 secret edition (“Labubu Express”).\nForm: Vinyl face blind-box figures.\nDeterministic product_id components: SKU unspecified; “popmart–coca-cola–blindbox.”\nAliases \\& tokens (EN/中文): Coca-Cola Labubu, 可口可乐系列, 拉布布可乐版.\nParent/child relations: Part of blind-box collectible lineup, multiple characters.\nPhysical spec:\nSize (h): Approx. 15.5–17 cm[^8_1].\nWeight: ~100 g per figure (inferred from packaging).\nMaterials: Shell: Polyester/ABS/PVC; Stuffing: Polyester/iron wire[^8_1].\nFinish: Matte vinyl face, plush-textured body.\nArticulation: Fixed.\nAccessories: None.\nColorway notes: Themed ski and winter outfits with Coca-Cola branding.\nPackaging \\& in-box contents:\nPackaging type: Blind-box carton.\nPackaging dimensions \\& weight: 6×6×8 in / 2 lb per box[^8_2].\nBox contents bill: 1 mystery figure, inner foil bag, QR code authenticity sticker.\nAuthenticity marker: QR code on inner bag.\nFactory/QA code: UPC 6931571026271[^8_2].\nEdition \\& run info:\nEdition.kind: Blind-box series.\nEdition size: Unknown; widespread global release.\nChase/rarity ratio: 1 secret:10 regular; secret odds 1:72[^8_3].\nStaff/member perks: None.\nCredits:\nOriginal designer/artist: Kasing Lung (龙家升).\nSculpt/model credits: POP MART design team.\nCollaboration partner: The Coca-Cola Company.\nLicensing owner: POP MART \\& Coca-Cola.\nRelease \\& distribution:\nAnnounced date: December 20, 2024[^8_4].\nRelease date: January 24, 2025[^8_1].\nDrop windows: Global blind-box launch online and in-store EQL drops (max 6/entry)[^8_5].\nPurchase limits: 6 per customer on EQL launch.\nQueues/mechanics: EQL lottery entry; global online blind-box.\nRestock: None.\nEnd-of-life: Series closed post-launch; sold out.\nRegional policy:\nRegion_lock: False.\nRegional codes: US, CN, SG, UK, AU (global).\nPackaging/regulatory differences: Local language on outer cartons, CE marking in EU.\nMarket listings (per region/channel):\nUS blind box: USD 38.99–39.99 at Target[^8_2]/POP MART.\nSet of 6: USD 239.94 on POP MART US.\nSecondary market: USD 60–100 per box; secret edition up to USD 5,000+.\nPurchase limit: 6 per customer.\nBlind-box specifics:\nSeries size: 11 total (10 + secret).\nOdds table: Regulars 1:11 each; secret 1:72 overall[^8_3].\nChecklist: Surf with Me; Crazy Ride; Vacation Fit; Snowy Mountain; Look What I Found; Special Sofa; Time to Cool Down; Little Snowman; Gift Delivery; … plus secret Labubu Express.\nCompliance \\& safety:\nAge rating: Not suitable under 15[^8_1].\nWarnings: Choking hazard small parts.\nCompliance marks: CE, RoHS.\nHS/customs category: 9503.00.69.\nCommerce \\& logistics adjuncts:\nSKU/model code: THE-MONSTERS-COCA-COLA-BLINDBOX.\nBarcode/EAN/UPC: 6931571026271[^8_2].\nShipping box info: Case of 6 blind boxes.\nReturn policy excerpt: 15-day returns on defective items.\nWarranty/support link: POP MART customer service.\nMedia \\& assets:\nHero image(s): Blind-box carton art.\nOrthographic angles: Front/back/inner bag.\nPackaging flats: Blind-box panel layout.\nIcon/thumb: Series logo.\nVideos: Multiple unboxing YouTube/TikTok reviews[^8_6][^8_7].\nImage rights note: POP MART \\& Coca-Cola.\nAsset hashes: None.\nProvenance \\& research trace:\nPrimary sources: POP MART US product page[^8_1], EQL landing page[^8_5].\nSecondary sources: Target listing[^8_2], Bagaholicboy guide[^8_3], YouTube unboxings[^8_6][^8_7], TikTok odds explainer[^8_8].\nRetrieved_at: 2025-08-13.\nDeltas: None.\nQuery ledger: “Pop Mart Coca-Cola blind box release details,” “Pop Mart Coca-Cola set USD239.94,” “Pop Mart Coca-Cola blind box checklist odds.”\ni18n \\& nomenclature:\nLocalized titles: 可口可乐系列盲盒 (CN).\nTransliteration: Labubu 可乐版.\nPer-locale notes: Mandarin, English, localized packaging.\nRelations \\& graph edges:\nPredecessor: None (first Coca-Cola collab).\nLateral variants: Figures vs plush blind-box (V3).\nShared collab capsule: Seasonal winter collab.\nSeries hub link: POP MART collab series.\nMarket intelligence (optional):\nOfficial price history: USD 39.99 launch; set of 6 for USD 239.94.\nSecondary market range: USD 60–USD 100; secret edition trades USD 3,000–USD 5,000.\nScarcity signals: Secret odds 1:72, sold out global blind-box launch.",
  "deltas": "None.",
  "source": "COMPLETED SEEDS.txt",
  "brand": "POP MART.",
  "line": "The Monsters x Coca-Cola.",
  "character": "Labubu \\& Zimomo.",
  "series": "Coca-Cola.",
  "product_title": "THE MONSTERS Coca-Cola Series – Vinyl Face Blind Box.",
  "variant_name": "10 standard figures + 1 secret edition (“Labubu Express”).",
  "form": "Vinyl face blind-box figures.",
  "deterministic_product_id_components": "SKU unspecified; “popmart–coca-cola–blindbox.”",
  "aliases_\\&_tokens_(en/中文)": "Coca-Cola Labubu, 可口可乐系列, 拉布布可乐版.",
  "parent/child_relations": "Part of blind-box collectible lineup, multiple characters.",
  "size_(h)": "Approx. 15.5–17 cm[^8_1].",
  "weight": "~100 g per figure (inferred from packaging).",
  "materials": "Shell: Polyester/ABS/PVC; Stuffing: Polyester/iron wire[^8_1].",
  "finish": "Matte vinyl face, plush-textured body.",
  "articulation": "Fixed.",
  "accessories": "None.",
  "colorway_notes": "Themed ski and winter outfits with Coca-Cola branding.",
  "packaging_type": "Blind-box carton.",
  "packaging_dimensions_\\&_weight": "6×6×8 in / 2 lb per box[^8_2].",
  "box_contents_bill": "1 mystery figure, inner foil bag, QR code authenticity sticker.",
  "authenticity_marker": "QR code on inner bag.",
  "factory/qa_code": "UPC 6931571026271[^8_2].",
  "edition.kind": "Blind-box series.",
  "edition_size": "Unknown; widespread global release.",
  "chase/rarity_ratio": "1 secret:10 regular; secret odds 1:72[^8_3].",
  "staff/member_perks": "None.",
  "original_designer/artist": "Kasing Lung (龙家升).",
  "sculpt/model_credits": "POP MART design team.",
  "collaboration_partner": "The Coca-Cola Company.",
  "licensing_owner": "POP MART \\& Coca-Cola.",
  "announced_date": "December 20, 2024[^8_4].",
  "release_date": "January 24, 2025[^8_1].",
  "drop_windows": "Global blind-box launch online and in-store EQL drops (max 6/entry)[^8_5].",
  "purchase_limits": "6 per customer on EQL launch.",
  "queues/mechanics": "EQL lottery entry; global online blind-box.",
  "restock": "None.",
  "end-of-life": "Series closed post-launch; sold out.",
  "region_lock": "False.",
  "regional_codes": "US, CN, SG, UK, AU (global).",
  "packaging/regulatory_differences": "Local language on outer cartons, CE marking in EU.",
  "us_blind_box": "USD 38.99–39.99 at Target[^8_2]/POP MART.",
  "set_of_6": "USD 239.94 on POP MART US.",
  "secondary_market": "USD 60–100 per box; secret edition up to USD 5,000+.",
  "purchase_limit": "6 per customer.",
  "series_size": "11 total (10 + secret).",
  "odds_table": "Regulars 1:11 each; secret 1:72 overall[^8_3].",
  "checklist": "Surf with Me; Crazy Ride; Vacation Fit; Snowy Mountain; Look What I Found; Special Sofa; Time to Cool Down; Little Snowman; Gift Delivery; … plus secret Labubu Express.",
  "age_rating": "Not suitable under 15[^8_1].",
  "warnings": "Choking hazard small parts.",
  "compliance_marks": "CE, RoHS.",
  "hs/customs_category": "9503.00.69.",
  "sku/model_code": "THE-MONSTERS-COCA-COLA-BLINDBOX.",
  "barcode/ean/upc": "6931571026271[^8_2].",
  "shipping_box_info": "Case of 6 blind boxes.",
  "return_policy_excerpt": "15-day returns on defective items.",
  "warranty/support_link": "POP MART customer service.",
  "hero_image(s)": "Blind-box carton art.",
  "orthographic_angles": "Front/back/inner bag.",
  "packaging_flats": "Blind-box panel layout.",
  "icon/thumb": "Series logo.",
  "videos": "Multiple unboxing YouTube/TikTok reviews[^8_6][^8_7].",
  "image_rights_note": "POP MART \\& Coca-Cola.",
  "asset_hashes": "None.",
  "primary_sources": "POP MART US product page[^8_1], EQL landing page[^8_5].",
  "secondary_sources": "Target listing[^8_2], Bagaholicboy guide[^8_3], YouTube unboxings[^8_6][^8_7], TikTok odds explainer[^8_8].",
  "retrieved_at": "2025-08-13.",
  "query_ledger": "“Pop Mart Coca-Cola blind box release details,” “Pop Mart Coca-Cola set USD239.94,” “Pop Mart Coca-Cola blind box checklist odds.”",
  "localized_titles": "可口可乐系列盲盒 (CN).",
  "transliteration": "Labubu 可乐版.",
  "per-locale_notes": "Mandarin, English, localized packaging.",
  "predecessor": "None (first Coca-Cola collab).",
  "lateral_variants": "Figures vs plush blind-box (V3).",
  "shared_collab_capsule": "Seasonal winter collab.",
  "series_hub_link": "POP MART collab series.",
  "official_price_history": "USD 39.99 launch; set of 6 for USD 239.94.",
  "secondary_market_range": "USD 60–USD 100; secret edition trades USD 3,000–USD 5,000.",
  "scarcity_signals": "Secret odds 1:72, sold out global blind-box launch.",
  "Deltas": []
}