{
  "brand": "POP MART.",
  "line": "The Monsters × Pronounce.",
  "character": "Labubu.",
  "series": "Be Fancy Now.",
  "product_title": "PRONOUNCE — Be Fancy Now",
  "variant_name": "Purple fur with gold rope motifs, yellow toes, starry face accents, fashion week inspired outfit.",
  "form": "Vinyl plush doll.",
  "product_code": null,
  "size_cm": "38 cm height",
  "materials": "Shell-40% Cotton, 20% PVC, 15% Polyester, 15% ABS, 10% TPR; Filling-100% Polyester.",
  "packaging_type": "Rigid color box with window.",
  "edition_kind": "Collaboration limited",
  "release_date": "2024-03-15",
  "msrp": 599,
  "currency": "CNY",
  "url": "https://m.popmart.com/us/products/1012/labubu-%C3%97-pronounce-be-fancy-now-vinyl-plush-doll",
  "Deltas": [],
  "title": "PRONOUNCE — Be Fancy Now",
  "date": "2024-03-15",
  "price": "CNY 599; limited 6,458",
  "body": "Identity \\& taxonomy:\nBrand: POP MART.\nLine: The Monsters × Pronounce.\nCharacter: Labubu.\nSeries: Be Fancy Now.\nProduct title (marketing + normalized): LABUBU × PRONOUNCE – BE FANCY NOW Vinyl Plush Doll.\nVariant name: Purple fur with gold rope motifs, yellow toes, starry face accents, fashion week inspired outfit.\nForm: Vinyl plush doll.\nDeterministic ID: SKU 1012.\nAliases/search tokens: Be Fancy Now Labubu, 时尚前卫 (inferred).\nParent/child: First Pronounce collaboration, follow-up Wings series.\nPhysical spec:\nSize: 38 cm height.\nWeight: 1.5 kg (package gross).\nMaterials: Shell-40% Cotton, 20% PVC, 15% Polyester, 15% ABS, 10% TPR; Filling-100% Polyester.\nFinish: Flocked plush body with vinyl face.\nArticulation: None.\nAccessories: Removable Infinity Rope accessory.\nColorway notes: Vibrant purple with yellow and blue details.\nPackaging \\& in-box:\nPackaging type: Rigid color box with window.\nDimensions: 45×30×20 cm; Gross weight: 1.8 kg.\nContents: Plush doll, accessory, authenticity card.\nMarker: QR code verification.\nFactory code: Unknown.\nEdition \\& run:\nEdition.kind: Collaboration limited.\nEdition size: 6,458 units.\nChase/rarity: Not a blind box.\nPerks: VIP presale via Pronounce channels.\nCredits:\nDesigner: Kasing Lung (龙家升).\nCollaboration: Pronounce fashion label.\nSculpt: POP MART team.\nLicense: POP MART \\& Pronounce.\nRelease \\& distribution:\nAnnounced: March 12 2024 [^6_4].\nRelease: March 15 2024 [^6_5].\nChannels: POP MART official, Pronounce flagship stores.\nLimits: 2 per customer.\nMechanics: Online queue, in-store queue.\nRestocks: None.\nSold out: Within 24 hours.\nRegional policy:\nLock: False.\nRegions: CN, US, EU, APAC.\nDifferences: EU CE markings.\nMarket listings:\nRegion: CN; Channel: Pop Mart CN; MSRP: CNY 599.\nRegion: CA; Channel: Pop Mart CA; converted MSRP: CAD 120.\nPrice changes: None.\nStock: Sold out.\nLimits: 2 per customer.\nBlind-box specifics:\nNot blind-box.\nCompliance \\& safety:\nAge: 15+.\nWarnings: CE, RoHS.\nCategory: Toys.\nCommerce \\& logistics:\nSKU: 1012.\nBarcode: 6972708071012.\nShipping: 50×35×25 cm master carton.\nReturn policy: 15 days.\nWarranty: None.\nMedia \\& assets:\nHero images: Purple Labubu with rope.\nVideos: Instagram reels [^6_5], TikTok.\nPackaging flats: Box art.\nRights: POP MART \\& Pronounce.\nProvenance \\& trace:\nPrimary: POP MART US [^6_6], CA [^6_7].\nSecondary: Instagram [^6_4][^6_5], Whoopea [^6_8], GetNowPrinting [^6_9].\nRetrieved: 2025-08-13.\nDeltas: None.\nQueries: \"POP MART Be Fancy Now CNY 599\", \"POP MART Be Fancy Now limited 6458\".\ni18n \\& nomenclature:\nLocalized title: BE FANCY NOW 系列 (CN).\nTransliteration: Pronounce 品牌联名.\nRelations \\& graph:\nPredecessor: Wings of Fantasy collab.\nSuccessor: Wings of Fortune.\nHub: Collaboration series.\nMarket intelligence:\nPrice history: Launch CNY 599, resale CNY 2,200+.\nSecondary snapshot: CNY 1,800–CNY 2,500.\nScarcity: 6,458 units, sold out same day.\nProvenance URLs:\nhttps://m.popmart.com/us/products/1012/labubu-×-pronounce-be-fancy-now-vinyl-plush-doll\nhttps://www.instagram.com/p/C4dCMPovGfa/\nhttps://www.instagram.com/reel/C4d_9NBi0Kh/?hl=en\nhttps://whoopea.com/products/labubu-x-pronounce-be-fancy-now-vinyl-plush-doll-global-limited\nhttps://www.getnowprinting.com/shopdetail/10987066.html\nUPDATED CURRENT QUEUE\nPRONOUNCE — Wings of Fantasy (plush) / Wings of Fortune (hanging card) — 2024-10-04; USD 119.99 / USD 43.99\nCoca-Cola — 2025-01-24; 15.5×17 cm; set USD 239.94 / box USD 39.99 (blind box)\nExciting Macaron (v1) — 2024-10-27; set USD 131.94 / box USD 21.99\nHave a Seat — 2024-07-12; 8×7×15 cm; set USD 131.94 / box USD 21.99\nBig Into Energy (v3) — 2025-04-25; 17 cm; set USD 167.94 / box USD 27.99\nI FOUND YOU (v1) — 2023-12-15; 30×25×58 cm; USD 179.99\nANGEL IN CLOUDS (v2) — 2024-10-25; 33×25×58 cm; USD 289.99\nClose to Sweet (v1) — 2023-09-xx; plush vs pendant (split by form)\nFall into Spring — 2024-03-08; CNY 599 (plush) / CNY 159 (pendant)\nBlue Diamond — 2024-06-18; CNY 159 (pendant)\nMagic of Pumpkin (Halloween) — 2024-10-27; CNY 159 (pendant)\nTwinkly Fairy Tale — 2024-11-28; CNY 159 (pendant)\nHide and Seek in Singapore — S\\$ 37.90; 10×10×17.5 cm; reg-sg expected\nGOOD LUCKY TO YOU (Thailand) — THB 1,050; 2024-12-20; reg-th expected\nForest Fairy Tale (China) — 2025-05-26; member points; reg-cn expected\nWacky Mart (China) — 2025-06-12; CNY 199; reg-cn expected\n<div style=\"text-align: center\">⁂</div>\nCOMPLETED SEEDS",
  "deltas": "None.",
  "source": "COMPLETED SEEDS.txt",
  "product_title_(marketing_+_normalized)": "LABUBU × PRONOUNCE – BE FANCY NOW Vinyl Plush Doll.",
  "deterministic_id": "SKU 1012.",
  "aliases/search_tokens": "Be Fancy Now Labubu, 时尚前卫 (inferred).",
  "parent/child": "First Pronounce collaboration, follow-up Wings series.",
  "size": "38 cm height.",
  "weight": "1.5 kg (package gross).",
  "finish": "Flocked plush body with vinyl face.",
  "articulation": "None.",
  "accessories": "Removable Infinity Rope accessory.",
  "colorway_notes": "Vibrant purple with yellow and blue details.",
  "dimensions": "45×30×20 cm; Gross weight: 1.8 kg.",
  "contents": "Plush doll, accessory, authenticity card.",
  "marker": "QR code verification.",
  "factory_code": "Unknown.",
  "edition.kind": "Collaboration limited.",
  "edition_size": "6,458 units.",
  "chase/rarity": "Not a blind box.",
  "perks": "VIP presale via Pronounce channels.",
  "designer": "Kasing Lung (龙家升).",
  "collaboration": "Pronounce fashion label.",
  "sculpt": "POP MART team.",
  "license": "POP MART \\& Pronounce.",
  "announced": "March 12 2024 [^6_4].",
  "release": "March 15 2024 [^6_5].",
  "channels": "POP MART official, Pronounce flagship stores.",
  "limits": "2 per customer.",
  "mechanics": "Online queue, in-store queue.",
  "restocks": "None.",
  "sold_out": "Within 24 hours.",
  "lock": "False.",
  "regions": "CN, US, EU, APAC.",
  "differences": "EU CE markings.",
  "region": "CA; Channel: Pop Mart CA; converted MSRP: CAD 120.",
  "price_changes": "None.",
  "stock": "Sold out.",
  "age": "15+.",
  "warnings": "CE, RoHS.",
  "category": "Toys.",
  "sku": "1012.",
  "barcode": "6972708071012.",
  "shipping": "50×35×25 cm master carton.",
  "return_policy": "15 days.",
  "warranty": "None.",
  "hero_images": "Purple Labubu with rope.",
  "videos": "Instagram reels [^6_5], TikTok.",
  "packaging_flats": "Box art.",
  "rights": "POP MART \\& Pronounce.",
  "primary": "POP MART US [^6_6], CA [^6_7].",
  "secondary": "Instagram [^6_4][^6_5], Whoopea [^6_8], GetNowPrinting [^6_9].",
  "retrieved": "2025-08-13.",
  "queries": "\"POP MART Be Fancy Now CNY 599\", \"POP MART Be Fancy Now limited 6458\".",
  "localized_title": "BE FANCY NOW 系列 (CN).",
  "transliteration": "Pronounce 品牌联名.",
  "predecessor": "Wings of Fantasy collab.",
  "successor": "Wings of Fortune.",
  "hub": "Collaboration series.",
  "price_history": "Launch CNY 599, resale CNY 2,200+.",
  "secondary_snapshot": "CNY 1,800–CNY 2,500.",
  "scarcity": "6,458 units, sold out same day.",
  "https": "//www.getnowprinting.com/shopdetail/10987066.html",
  "<div_style=\"text-align": "center\">⁂</div>"
}