{
  "brand": "POP MART.",
  "line": "The Monsters.",
  "character": "Labubu.",
  "series": "Walk by Fortune.",
  "product_title": "Walk by Fortune (CNY)",
  "variant_name": "Chinese New Year theme with traditional red outfit, sitting pose",
  "form": "Vinyl plush doll.",
  "product_code": "Unknown",
  "size_cm": "Approximately 15.75 inches / 40cm height",
  "materials": "PLUSH+PVC.",
  "packaging_type": "Color box.",
  "edition_kind": "Limited edition",
  "release_date": "2023-12-29",
  "msrp": 499,
  "currency": "CNY",
  "url": "https://figpalace.com/blogs/guide/labubu-zimomo-mokoko-series-list",
  "Deltas": [],
  "title": "Walk by Fortune (CNY)",
  "msrp_currency": "CNY",
  "product_id": "Unknown",
  "size": "Approximately 15.75 inches / 40cm height",
  "weight": null,
  "finish": "Soft plush body with vinyl face",
  "articulation": "Unknown",
  "deltas": "None.",
  "date": "2023-12-29",
  "price": "CNY 499",
  "body": "Identity \\& taxonomy:\nBrand: POP MART.\nLine: The Monsters.\nCharacter: Labubu.\nSeries: Walk by Fortune.\nProduct title (marketing title + normalized title): THE MONSTERS – WALK BY FORTUNE Vinyl Plush Doll.\nVariant name (colorway, pose, outfit): Chinese New Year theme with traditional red outfit, sitting pose.\nForm: Vinyl plush doll.\nDeterministic product_id components: Unknown.\nAliases \\& search tokens (EN/中文; common misspellings): Walk by Fortune Labubu, 拉布布招财进宝 (inferred from series context).\nParent/child relations (reissue, seasonal of core, collab of core): Limited seasonal edition for Chinese New Year 2024, no direct reissue noted.\nPhysical spec:\nSize (h/w/d in cm): Approximately 15.75 inches / 40cm height.\nWeight (grams): Unknown.\nMaterials: PLUSH+PVC.\nFinish (matte, flocked, metallic, translucent): Soft plush body with vinyl face.\nArticulation/motion: Unknown.\nAccessories in box: Unknown.\nColorway notes: Traditional red Chinese New Year theme.\nPackaging \\& in-box contents:\nPackaging type: Color box.\nPackaging dimensions \\& weight: Unknown.\nBox contents bill: Plush doll, authenticity card (inferred).\nAuthenticity/anti-counterfeit marker: QR code (inferred).\nFactory/QA code: Unknown.\nEdition \\& run info:\nEdition.kind: Limited edition.\nEdition size (unit_count): 3,000 units.\nChase/rarity ratio: Not applicable (limited quantity, non-blind box).\nStaff/member perks: Unknown.\nCredits:\nOriginal designer/artist (EN \\& 中文): Kasing Lung (龙家升).\nSculpt/model credits: POP MART design team.\nCollaboration partner: None.\nLicensing owner: POP MART.\nRelease \\& distribution:\nAnnounced date: Unknown.\nRelease date (authoritative; log deltas if contradicted): December 29, 2023.\nDrop windows (channels): POP MART official online store, limited release.\nPurchase limits: Unknown.\nQueues/mechanics: Limited to 3,000 units, sold out quickly.\nRestock/second wave dates: No restocks due to limited edition nature.\nEnd-of-life or \"sold out\" date: Sold out immediately due to limited quantity.\nRegional policy:\nRegion_lock (true/false; explanation): Unknown; likely available in CN market primarily.\nRegional codes involved: CN (primary).\nPackaging/regulatory differences: Unknown.\nMarket listings (per region/channel):\nRegion code: CN.\nChannel: POP MART official site.\nLaunch MSRP (currency + numeric): CNY499.\nSubsequent official price changes: Unknown.\nStock status snapshots: Sold out, reseller prices up to USD1,169.22.\nPurchase limit at listing: Unknown.\nBlind-box specifics (if relevant):\nNot applicable (single limited edition plush doll, not blind box).\nCompliance \\& safety:\nAge rating: 15+.\nWarnings: Unknown.\nCompliance marks: CE certification.\nHS/customs category: Unknown.\nCommerce \\& logistics adjuncts:\nSKU/model code: Unknown.\nBarcode/EAN/UPC: Unknown.\nShipping box info: Unknown.\nReturn policy excerpt: Standard returns (inferred).\nWarranty/support link: Unknown.\nMedia \\& assets:\nHero image(s): Labubu in traditional red Chinese New Year outfit.\nOrthographic angles: Front views.\nPackaging flats: Color box with CNY theme.\nIcon/thumb: Unknown.\nVideos: Unboxing videos.\nImage rights note: Official POP MART assets.\nAsset hashes: Unknown.\nProvenance \\& research trace:\nPrimary sources used: Fig Palace, POP MART official sites.\nSecondary sources used: Toysez, YouTube reviews, collector sites.\nCapture artifacts (retrieved_at, hash): Retrieved 2025-08-13; hashes unknown.\nContradiction log (deltas): No deltas on release date or MSRP.\nQuery ledger (top 6–10 queries): \"POP MART Walk by Fortune CNY 2023 limited 3000\", \"POP MART Walk by Fortune Chinese New Year plush doll 2023\", \"POP MART Walk by Fortune CNY 499 2023-12-29\", \"POP MART Walk by Fortune specifications\", \"POP MART Walk by Fortune materials packaging\", \"POP MART Walk by Fortune edition size\", \"POP MART Walk by Fortune credits\", \"POP MART Walk by Fortune regional policy\".\ni18n \\& nomenclature:\nLocalized titles: Walk by Fortune (EN), 招财进宝 (CN, inferred).\nTransliteration notes: Labubu as 拉布布.\nPer-locale notes: Chinese New Year specific theming.\nRelations \\& graph edges:\nPredecessor/successor: Part of seasonal CNY collection.\nLateral variants: Paired with Best of Luck overseas exclusive.\nSame sculpt/different finish: Similar limited edition format.\nShared collab capsule: Chinese New Year 2024 theme.\nSeries hub link: POP MART seasonal exclusives.\nMarket intelligence (optional):\nOfficial price history timeline: Launched at CNY499, reseller prices up to USD1,169.22.\nSecondary market range snapshots: Extremely high secondary market value due to limited edition nature.\nScarcity signals: Limited to 3,000 units, immediate sellout, high collector demand.\nProvenance URLs:\nhttps://figpalace.com/blogs/guide/labubu-zimomo-mokoko-series-list\nhttps://toysez.com/products/labubu-the-monsters-walk-by-fortune-vinyl-plush-doll-limited\nhttps://labubucollector.com/labubu-release-date/\nhttps://arttoyfamilia.com/products/labubu-walk-by-fortune-plush-doll-搪胶毛绒公仔\nhttps://toylandhk.com/en/products/the-monsters-walk-by-fortune-vinyl-plush-doll?section_id=quick-view\nhttps://www.tiktok.com/discover/popmart-walk-by-fortune-labubu\nDeltas: None.",
  "source": "COMPLETED SEEDS.txt",
  "product_title_(marketing_title_+_normalized_title)": "THE MONSTERS – WALK BY FORTUNE Vinyl Plush Doll.",
  "variant_name_(colorway,_pose,_outfit)": "Chinese New Year theme with traditional red outfit, sitting pose.",
  "deterministic_product_id_components": "Unknown.",
  "aliases_\\&_search_tokens_(en/中文;_common_misspellings)": "Walk by Fortune Labubu, 拉布布招财进宝 (inferred from series context).",
  "parent/child_relations_(reissue,_seasonal_of_core,_collab_of_core)": "Limited seasonal edition for Chinese New Year 2024, no direct reissue noted.",
  "size_(h/w/d_in_cm)": "Approximately 15.75 inches / 40cm height.",
  "weight_(grams)": "Unknown.",
  "finish_(matte,_flocked,_metallic,_translucent)": "Soft plush body with vinyl face.",
  "articulation/motion": "Unknown.",
  "accessories_in_box": "Unknown.",
  "colorway_notes": "Traditional red Chinese New Year theme.",
  "packaging_dimensions_\\&_weight": "Unknown.",
  "box_contents_bill": "Plush doll, authenticity card (inferred).",
  "authenticity/anti-counterfeit_marker": "QR code (inferred).",
  "factory/qa_code": "Unknown.",
  "edition.kind": "Limited edition.",
  "edition_size_(unit_count)": "3,000 units.",
  "chase/rarity_ratio": "Not applicable (limited quantity, non-blind box).",
  "staff/member_perks": "Unknown.",
  "original_designer/artist_(en_\\&_中文)": "Kasing Lung (龙家升).",
  "sculpt/model_credits": "POP MART design team.",
  "collaboration_partner": "None.",
  "licensing_owner": "POP MART.",
  "announced_date": "Unknown.",
  "release_date_(authoritative;_log_deltas_if_contradicted)": "December 29, 2023.",
  "drop_windows_(channels)": "POP MART official online store, limited release.",
  "purchase_limits": "Unknown.",
  "queues/mechanics": "Limited to 3,000 units, sold out quickly.",
  "restock/second_wave_dates": "No restocks due to limited edition nature.",
  "end-of-life_or_\"sold_out\"_date": "Sold out immediately due to limited quantity.",
  "region_lock_(true/false;_explanation)": "Unknown; likely available in CN market primarily.",
  "regional_codes_involved": "CN (primary).",
  "packaging/regulatory_differences": "Unknown.",
  "region_code": "CN.",
  "channel": "POP MART official site.",
  "launch_msrp_(currency_+_numeric)": "CNY499.",
  "subsequent_official_price_changes": "Unknown.",
  "stock_status_snapshots": "Sold out, reseller prices up to USD1,169.22.",
  "purchase_limit_at_listing": "Unknown.",
  "age_rating": "15+.",
  "warnings": "Unknown.",
  "compliance_marks": "CE certification.",
  "hs/customs_category": "Unknown.",
  "sku/model_code": "Unknown.",
  "barcode/ean/upc": "Unknown.",
  "shipping_box_info": "Unknown.",
  "return_policy_excerpt": "Standard returns (inferred).",
  "warranty/support_link": "Unknown.",
  "hero_image(s)": "Labubu in traditional red Chinese New Year outfit.",
  "orthographic_angles": "Front views.",
  "packaging_flats": "Color box with CNY theme.",
  "icon/thumb": "Unknown.",
  "videos": "Unboxing videos.",
  "image_rights_note": "Official POP MART assets.",
  "asset_hashes": "Unknown.",
  "primary_sources_used": "Fig Palace, POP MART official sites.",
  "secondary_sources_used": "Toysez, YouTube reviews, collector sites.",
  "capture_artifacts_(retrieved_at,_hash)": "Retrieved 2025-08-13; hashes unknown.",
  "contradiction_log_(deltas)": "No deltas on release date or MSRP.",
  "query_ledger_(top_6–10_queries)": "\"POP MART Walk by Fortune CNY 2023 limited 3000\", \"POP MART Walk by Fortune Chinese New Year plush doll 2023\", \"POP MART Walk by Fortune CNY 499 2023-12-29\", \"POP MART Walk by Fortune specifications\", \"POP MART Walk by Fortune materials packaging\", \"POP MART Walk by Fortune edition size\", \"POP MART Walk by Fortune credits\", \"POP MART Walk by Fortune regional policy\".",
  "localized_titles": "Walk by Fortune (EN), 招财进宝 (CN, inferred).",
  "transliteration_notes": "Labubu as 拉布布.",
  "per-locale_notes": "Chinese New Year specific theming.",
  "predecessor/successor": "Part of seasonal CNY collection.",
  "lateral_variants": "Paired with Best of Luck overseas exclusive.",
  "same_sculpt/different_finish": "Similar limited edition format.",
  "shared_collab_capsule": "Chinese New Year 2024 theme.",
  "series_hub_link": "POP MART seasonal exclusives.",
  "official_price_history_timeline": "Launched at CNY499, reseller prices up to USD1,169.22.",
  "secondary_market_range_snapshots": "Extremely high secondary market value due to limited edition nature.",
  "scarcity_signals": "Limited to 3,000 units, immediate sellout, high collector demand.",
  "https": "//www.tiktok.com/discover/popmart-walk-by-fortune-labubu"
}
