{
  "brand": "POP MART.",
  "line": "The Monsters.",
  "character": "Labubu.",
  "series": "Jump for Joy.",
  "product_title": "Jump for Joy",
  "variant_name": "Galaxy grey coat with bomber jacket, cargo pants, and boots",
  "form": "Vinyl plush doll.",
  "product_code": "Unknown",
  "size_cm": "18×16×38 cm",
  "materials": "PU, PP, polyester, fabric.",
  "packaging_type": "Color box.",
  "edition_kind": "Standard edition",
  "release_date": "2023-05-26",
  "msrp": 499,
  "currency": "CNY",
  "url": "https://www.instagram.com/reel/Csip88egS27/?hl=en",
  "Deltas": [],
  "title": "Jump for Joy",
  "date": "2023-05-26",
  "price": "CNY 499 (plush)",
  "body": "Identity \\& taxonomy:\nBrand: POP MART.\nLine: The Monsters.\nCharacter: Labubu.\nSeries: Jump for Joy.\nProduct title (marketing title + normalized title): THE MONSTERS – JUMP FOR JOY Vinyl Plush Doll.\nVariant name (colorway, pose, outfit): Galaxy grey coat with bomber jacket, cargo pants, and boots.\nForm: Vinyl plush doll.\nDeterministic product_id components: Unknown.\nAliases \\& search tokens (EN/中文; common misspellings): Jump for Joy Labubu, 拉布布跳跃欢乐 (inferred from series context).\nParent/child relations (reissue, seasonal of core, collab of core): Core variant in The Monsters universe, no direct reissue noted[^2_1][^2_2].\nPhysical spec:\nSize (h/w/d in cm): 18×16×38 cm.\nWeight (grams): Unknown.\nMaterials: PU, PP, polyester, fabric.\nFinish (matte, flocked, metallic, translucent): Soft plush body with vinyl face.\nArticulation/motion: Posable hands.\nAccessories in box: None specified.\nColorway notes: Grey fur with urban outfit accents[^2_3][^2_4][^2_2][^2_5].\nPackaging \\& in-box contents:\nPackaging type: Color box.\nPackaging dimensions \\& weight: Unknown.\nBox contents bill: Plush doll, authenticity card (inferred from series standards).\nAuthenticity/anti-counterfeit marker: QR code for verification.\nFactory/QA code: Unknown[^2_1].\nEdition \\& run info:\nEdition.kind: Standard edition.\nEdition size (unit_count): Unknown.\nChase/rarity ratio: Not applicable (non-blind box).\nStaff/member perks: Unknown.\nCredits:\nOriginal designer/artist (EN \\& 中文): Kasing Lung (龙家升).\nSculpt/model credits: Unknown.\nCollaboration partner: None.\nLicensing owner: POP MART[^2_1][^2_6].\nRelease \\& distribution:\nAnnounced date: Unknown.\nRelease date (authoritative; log deltas if contradicted): 2023-05-26.\nDrop windows (channels): POP MART official online store, global sites.\nPurchase limits: Unknown.\nQueues/mechanics: Sold out quickly.\nRestock/second wave dates: Unknown.\nEnd-of-life or “sold out” date: Sold out immediately upon release[^2_7][^2_3][^2_1][^2_4][^2_8].\nRegional policy:\nRegion_lock (true/false; explanation): False; available internationally via POP MART sites.\nRegional codes involved: US, CN, global.\nPackaging/regulatory differences: Unknown[^2_1].\nMarket listings (per region/channel):\nRegion code: CN.\nChannel: POP MART official site.\nLaunch MSRP (currency + numeric): CNY499.\nSubsequent official price changes: Unknown.\nStock status snapshots: Sold out, available via resellers at higher prices (e.g., ₱41,900).\nPurchase limit at listing: Unknown[^2_1][^2_9][^2_5].\nBlind-box specifics (if relevant):\nNot applicable (single plush doll, not blind box).\nCompliance \\& safety:\nAge rating: Not suitable for persons under 15.\nWarnings: Unknown.\nCompliance marks: Unknown.\nHS/customs category: Unknown[^2_3][^2_4].\nCommerce \\& logistics adjuncts:\nSKU/model code: Unknown.\nBarcode/EAN/UPC: Unknown.\nShipping box info: Unknown.\nReturn policy excerpt: Standard POP MART returns (inferred).\nWarranty/support link: Unknown.\nMedia \\& assets:\nHero image(s): Labubu in bomber jacket outfit.\nOrthographic angles: Front and side views.\nPackaging flats: Color box with artwork.\nIcon/thumb: Unknown.\nVideos: Unboxing videos.\nImage rights note: Official POP MART assets.\nAsset hashes: Unknown[^2_7][^2_2].\nProvenance \\& research trace:\nPrimary sources used: POP MART official site, Instagram.\nSecondary sources used: Fig Palace, Bagaholicboy.\nCapture artifacts (retrieved_at, hash): Retrieved 2025-08-13; hashes unknown.\nContradiction log (deltas): Release date adjusted to 2023-05-26 from seed's 2023-05-25 based on multiple sources.\nQuery ledger (top 6–10 queries): \"Pop Mart Jump for Joy plush 2023 release\", \"Pop Mart Jump for Joy plush 2023 price\", \"Pop Mart Jump for Joy plush 2023 physical specifications\", \"Pop Mart Jump for Joy variants\", \"Pop Mart Jump for Joy materials\", \"Pop Mart Jump for Joy packaging\", \"Pop Mart Jump for Joy edition size\", \"Pop Mart Jump for Joy credits\".\ni18n \\& nomenclature:\nLocalized titles: Jump for Joy (EN), 跳跃欢乐 (CN, inferred).\nTransliteration notes: Labubu as 拉布布.\nPer-locale notes: English and Chinese marketing[^2_1].\nRelations \\& graph edges:\nPredecessor/successor: Part of ongoing The Monsters series.\nLateral variants: Other Labubu plush like Dress be Latte.\nSame sculpt/different finish: Similar vinyl plush format to other series.\nShared collab capsule: None.\nSeries hub link: POP MART The Monsters collection[^2_1].\nMarket intelligence (optional):\nOfficial price history timeline: Launched at CNY499, reseller prices up to ₱47,895 as of 2024.\nSecondary market range snapshots: High demand with prices around ₱41,900–₱47,895.\nScarcity signals: Frequently sold out, rare find at retail[^2_1][^2_9][^2_2][^2_5].\nProvenance URLs:\nhttps://www.instagram.com/reel/Csip88egS27/?hl=en\nhttps://m.popmart.com/us/products/874/\nhttps://figpalace.com/blogs/guide/labubu-zimomo-mokoko-series-list\nhttps://m.popmart.com/us/products/281/\nhttps://www.instagram.com/p/DBskzrgP9Nl/?hl=en\nhttps://en.wikipedia.org/wiki/Pop_Mart\nhttps://m.alibaba.com/showroom/big-tall-doll.html\nhttps://bagaholicboy.com/2024/08/the-monsters-vinyl-plush-doll-and-doll-pendants\nhttps://x.com/POPMARTGlobal/status/1660655301593374728\nhttps://shoegamemanila.myshopify.com/products/pop-mart-the-monsters-jump-for-joy-vinyl-plush-doll\nDeltas: Release date contradicted by sources; adjusted to 2023-05-26[^2_7][^2_3][^2_1][^2_4][^2_8].",
  "deltas": "Release date contradicted by sources; adjusted to 2023-05-26[^2_7][^2_3][^2_1][^2_4][^2_8].",
  "source": "COMPLETED SEEDS.txt",
  "product_title_(marketing_title_+_normalized_title)": "THE MONSTERS – JUMP FOR JOY Vinyl Plush Doll.",
  "variant_name_(colorway,_pose,_outfit)": "Galaxy grey coat with bomber jacket, cargo pants, and boots.",
  "deterministic_product_id_components": "Unknown.",
  "aliases_\\&_search_tokens_(en/中文;_common_misspellings)": "Jump for Joy Labubu, 拉布布跳跃欢乐 (inferred from series context).",
  "parent/child_relations_(reissue,_seasonal_of_core,_collab_of_core)": "Core variant in The Monsters universe, no direct reissue noted[^2_1][^2_2].",
  "size_(h/w/d_in_cm)": "18×16×38 cm.",
  "weight_(grams)": "Unknown.",
  "finish_(matte,_flocked,_metallic,_translucent)": "Soft plush body with vinyl face.",
  "articulation/motion": "Posable hands.",
  "accessories_in_box": "None specified.",
  "colorway_notes": "Grey fur with urban outfit accents[^2_3][^2_4][^2_2][^2_5].",
  "packaging_dimensions_\\&_weight": "Unknown.",
  "box_contents_bill": "Plush doll, authenticity card (inferred from series standards).",
  "authenticity/anti-counterfeit_marker": "QR code for verification.",
  "factory/qa_code": "Unknown[^2_1].",
  "edition.kind": "Standard edition.",
  "edition_size_(unit_count)": "Unknown.",
  "chase/rarity_ratio": "Not applicable (non-blind box).",
  "staff/member_perks": "Unknown.",
  "original_designer/artist_(en_\\&_中文)": "Kasing Lung (龙家升).",
  "sculpt/model_credits": "Unknown.",
  "collaboration_partner": "None.",
  "licensing_owner": "POP MART[^2_1][^2_6].",
  "announced_date": "Unknown.",
  "release_date_(authoritative;_log_deltas_if_contradicted)": "2023-05-26.",
  "drop_windows_(channels)": "POP MART official online store, global sites.",
  "purchase_limits": "Unknown.",
  "queues/mechanics": "Sold out quickly.",
  "restock/second_wave_dates": "Unknown.",
  "end-of-life_or_“sold_out”_date": "Sold out immediately upon release[^2_7][^2_3][^2_1][^2_4][^2_8].",
  "region_lock_(true/false;_explanation)": "False; available internationally via POP MART sites.",
  "regional_codes_involved": "US, CN, global.",
  "packaging/regulatory_differences": "Unknown[^2_1].",
  "region_code": "CN.",
  "channel": "POP MART official site.",
  "launch_msrp_(currency_+_numeric)": "CNY499.",
  "subsequent_official_price_changes": "Unknown.",
  "stock_status_snapshots": "Sold out, available via resellers at higher prices (e.g., ₱41,900).",
  "purchase_limit_at_listing": "Unknown[^2_1][^2_9][^2_5].",
  "age_rating": "Not suitable for persons under 15.",
  "warnings": "Unknown.",
  "compliance_marks": "Unknown.",
  "hs/customs_category": "Unknown[^2_3][^2_4].",
  "sku/model_code": "Unknown.",
  "barcode/ean/upc": "Unknown.",
  "shipping_box_info": "Unknown.",
  "return_policy_excerpt": "Standard POP MART returns (inferred).",
  "warranty/support_link": "Unknown.",
  "hero_image(s)": "Labubu in bomber jacket outfit.",
  "orthographic_angles": "Front and side views.",
  "packaging_flats": "Color box with artwork.",
  "icon/thumb": "Unknown.",
  "videos": "Unboxing videos.",
  "image_rights_note": "Official POP MART assets.",
  "asset_hashes": "Unknown[^2_7][^2_2].",
  "primary_sources_used": "POP MART official site, Instagram.",
  "secondary_sources_used": "Fig Palace, Bagaholicboy.",
  "capture_artifacts_(retrieved_at,_hash)": "Retrieved 2025-08-13; hashes unknown.",
  "contradiction_log_(deltas)": "Release date adjusted to 2023-05-26 from seed's 2023-05-25 based on multiple sources.",
  "query_ledger_(top_6–10_queries)": "\"Pop Mart Jump for Joy plush 2023 release\", \"Pop Mart Jump for Joy plush 2023 price\", \"Pop Mart Jump for Joy plush 2023 physical specifications\", \"Pop Mart Jump for Joy variants\", \"Pop Mart Jump for Joy materials\", \"Pop Mart Jump for Joy packaging\", \"Pop Mart Jump for Joy edition size\", \"Pop Mart Jump for Joy credits\".",
  "localized_titles": "Jump for Joy (EN), 跳跃欢乐 (CN, inferred).",
  "transliteration_notes": "Labubu as 拉布布.",
  "per-locale_notes": "English and Chinese marketing[^2_1].",
  "predecessor/successor": "Part of ongoing The Monsters series.",
  "lateral_variants": "Other Labubu plush like Dress be Latte.",
  "same_sculpt/different_finish": "Similar vinyl plush format to other series.",
  "shared_collab_capsule": "None.",
  "series_hub_link": "POP MART The Monsters collection[^2_1].",
  "official_price_history_timeline": "Launched at CNY499, reseller prices up to ₱47,895 as of 2024.",
  "secondary_market_range_snapshots": "High demand with prices around ₱41,900–₱47,895.",
  "scarcity_signals": "Frequently sold out, rare find at retail[^2_1][^2_9][^2_2][^2_5].",
  "https": "//shoegamemanila.myshopify.com/products/pop-mart-the-monsters-jump-for-joy-vinyl-plush-doll"
}
