{
  "brand": "POP MART.",
  "line": "The Monsters.",
  "character": "Labubu.",
  "series": "Dress be Latte.",
  "product_title": "Dress be Latte",
  "variant_name": "Latte shades with furry bucket hat, knit shirt, scarf, pants, shoulder bag, shoes",
  "form": "Vinyl plush doll.",
  "product_code": "Unknown",
  "size_cm": "Approximately 38 cm height (inferred from series standards)",
  "materials": "ABS, PVC, plush fabric.",
  "packaging_type": "Color box.",
  "edition_kind": "Standard edition",
  "release_date": "2023-10-27",
  "msrp": 499,
  "currency": "CNY",
  "url": "https://figpalace.com/blogs/guide/labubu-zimomo-mokoko-series-list",
  "Deltas": [],
  "title": "Dress be Latte",
  "date": "2023-10-27",
  "price": "CNY 499 (plush)",
  "body": "Identity \\& taxonomy:\nBrand: POP MART.\nLine: The Monsters.\nCharacter: Labubu.\nSeries: Dress be Latte.\nProduct title (marketing title + normalized title): THE MONSTERS – DRESS BE LATTE Vinyl Plush Doll.\nVariant name (colorway, pose, outfit): Latte shades with furry bucket hat, knit shirt, scarf, pants, shoulder bag, shoes.\nForm: Vinyl plush doll.\nDeterministic product_id components: Unknown.\nAliases \\& search tokens (EN/中文; common misspellings): Dress be Latte Labubu, 拉布布拿铁装扮 (inferred from series context).\nParent/child relations (reissue, seasonal of core, collab of core): Core variant in The Monsters universe, fall-winter seasonal theme, no direct reissue noted[^2_1][^2_2].\nPhysical spec:\nSize (h/w/d in cm): Approximately 38 cm height (inferred from series standards).\nWeight (grams): Unknown.\nMaterials: ABS, PVC, plush fabric.\nFinish (matte, flocked, metallic, translucent): Soft fluffy plush with vinyl elements.\nArticulation/motion: Unknown.\nAccessories in box: None specified.\nColorway notes: Latte-toned outfit with fluffy accents[^2_2][^2_10][^2_11].\nPackaging \\& in-box contents:\nPackaging type: Color box.\nPackaging dimensions \\& weight: Unknown.\nBox contents bill: Plush doll.\nAuthenticity/anti-counterfeit marker: QR code (inferred).\nFactory/QA code: Unknown[^2_1].\nEdition \\& run info:\nEdition.kind: Standard edition.\nEdition size (unit_count): Unknown.\nChase/rarity ratio: Not applicable (non-blind box).\nStaff/member perks: Unknown.\nCredits:\nOriginal designer/artist (EN \\& 中文): Kasing Lung (龙家升).\nSculpt/model credits: Unknown.\nCollaboration partner: None.\nLicensing owner: POP MART[^2_1][^2_6].\nRelease \\& distribution:\nAnnounced date: Unknown.\nRelease date (authoritative; log deltas if contradicted): 2023-10-27.\nDrop windows (channels): POP MART official online store, global sites.\nPurchase limits: Unknown.\nQueues/mechanics: Sold out quickly.\nRestock/second wave dates: Unknown.\nEnd-of-life or “sold out” date: Sold out upon release[^2_1][^2_10][^2_12].\nRegional policy:\nRegion_lock (true/false; explanation): False; available internationally.\nRegional codes involved: US, CN, global.\nPackaging/regulatory differences: Unknown[^2_1].\nMarket listings (per region/channel):\nRegion code: CN.\nChannel: POP MART official site.\nLaunch MSRP (currency + numeric): CNY499.\nSubsequent official price changes: Unknown.\nStock status snapshots: Sold out, reseller prices up to \\$486.\nPurchase limit at listing: Unknown[^2_1][^2_2][^2_10].\nBlind-box specifics (if relevant):\nNot applicable (single plush doll, not blind box).\nCompliance \\& safety:\nAge rating: Not suitable for persons under 15.\nWarnings: Unknown.\nCompliance marks: Unknown.\nHS/customs category: Unknown[^2_10][^2_11].\nCommerce \\& logistics adjuncts:\nSKU/model code: Unknown.\nBarcode/EAN/UPC: Unknown.\nShipping box info: Unknown.\nReturn policy excerpt: Standard returns.\nWarranty/support link: Unknown.\nMedia \\& assets:\nHero image(s): Labubu in latte outfit.\nOrthographic angles: Front views.\nPackaging flats: Color box.\nIcon/thumb: Unknown.\nVideos: Unboxing.\nImage rights note: Official assets.\nAsset hashes: Unknown[^2_2][^2_12][^2_13].\nProvenance \\& research trace:\nPrimary sources used: POP MART site, Instagram.\nSecondary sources used: Fig Palace, Blindboxmall.\nCapture artifacts (retrieved_at, hash): Retrieved 2025-08-13; hashes unknown.\nContradiction log (deltas): Release date adjusted to 2023-10-27 from seed's 2023-10-26.\nQuery ledger (top 6–10 queries): \"Pop Mart Dress be Latte plush 2023 release\", \"Pop Mart Dress be Latte plush 2023 price\", \"Pop Mart Dress be Latte plush 2023 physical specifications\", \"Pop Mart Dress be Latte variants\", \"Pop Mart Dress be Latte materials\", \"Pop Mart Dress be Latte packaging\", \"Pop Mart Dress be Latte edition size\", \"Pop Mart Dress be Latte credits\".\ni18n \\& nomenclature:\nLocalized titles: Dress be Latte (EN), 拿铁装扮 (CN, inferred).\nTransliteration notes: Labubu as 拉布布.\nPer-locale notes: English and Chinese[^2_1].\nRelations \\& graph edges:\nPredecessor/successor: Part of The Monsters series.\nLateral variants: Jump for Joy, other plush.\nSame sculpt/different finish: Similar format.\nShared collab capsule: None.\nSeries hub link: POP MART collection[^2_1].\nMarket intelligence (optional):\nOfficial price history timeline: Launched at CNY499, resellers at \\$486.\nSecondary market range snapshots: High secondary prices.\nScarcity signals: Sold out, collectible demand[^2_1][^2_2][^2_10][^2_13].\nProvenance URLs:\nhttps://figpalace.com/blogs/guide/labubu-zimomo-mokoko-series-list\nhttps://bagaholicboy.com/2024/08/the-monsters-vinyl-plush-doll-and-doll-pendants\nhttps://blindboxmall.com/products/pop-mart-the-monsters-dress-be-latte-vinyl-plush-doll\nhttps://www.popmart.com/be/products/525/\nhttps://x.com/POPMARTGlobal/status/1715396274352980341?lang=en\nhttps://www.instagram.com/reel/C53wrJLSxlC/\nhttps://www.popmart.com/ie/products/525\nhttps://fr.pinterest.com/pin/the-monsters-dress-be-latte-vinyl-plush-doll--418412621656709921/\nDeltas: Release date contradicted; adjusted to 2023-10-27[^2_1][^2_10][^2_12][^2_11].\nUPDATED CURRENT QUEUE\nFlip with Me — 2024-07-12; plush 40×20×15 cm; CN/US pricing exists\nFall in Wild — 2024-07-12; plush 40×20×15 and keychain pendant 17 cm\nLet’s Checkmate (Doll) — 2025-02-07; 37 cm; USD 114.99\nLet’s Checkmate (Hanging Card) — 2025-02-07; 17 cm; USD 39.99\nWalk by Fortune (CNY) — 2023-12-29; CNY 499; limited 3,000\nBest of Luck（海外限定） — 2023-12-30; CNY 499; limited 3,000; likely regional exclusive\nHappy Halloween Party — 2024-10-25; AU\\$ 50 (keychain pendant)\nPRONOUNCE — Be Fancy Now — 2024-03-15; CNY 599; limited 6,458\nPRONOUNCE — Wings of Fantasy (plush) / Wings of Fortune (hanging card) — 2024-10-04; USD 119.99 / USD 43.99\nCoca-Cola — 2025-01-24; 15.5×17 cm; set USD 239.94 / box USD 39.99 (blind box)\nExciting Macaron (v1) — 2024-10-27; set USD 131.94 / box USD 21.99\nHave a Seat — 2024-07-12; 8×7×15 cm; set USD 131.94 / box USD 21.99\nBig Into Energy (v3) — 2025-04-25; 17 cm; set USD 167.94 / box USD 27.99\nI FOUND YOU (v1) — 2023-12-15; 30×25×58 cm; USD 179.99\nANGEL IN CLOUDS (v2) — 2024-10-25; 33×25×58 cm; USD 289.99\nClose to Sweet (v1) — 2023-09-xx; plush vs pendant (split by form)\nFall into Spring — 2024-03-08; CNY 599 (plush) / CNY 159 (pendant)\nBlue Diamond — 2024-06-18; CNY 159 (pendant)\nMagic of Pumpkin (Halloween) — 2024-10-27; CNY 159 (pendant)\nTwinkly Fairy Tale — 2024-11-28; CNY 159 (pendant)\nHide and Seek in Singapore — S\\$37.90; 10×10×17.5 cm; reg-sg expected\nGOOD LUCKY TO YOU (Thailand) — THB 1,050; 2024-12-20; reg-th expected\nForest Fairy Tale (China) — 2025-05-26; member points; reg-cn expected\nWacky Mart (China) — 2025-06-12; CNY 199; reg-cn expected\n<div style=\"text-align: center\">⁂</div>\nCOMPLETED SEEDS",
  "deltas": "Release date contradicted; adjusted to 2023-10-27[^2_1][^2_10][^2_12][^2_11].",
  "source": "COMPLETED SEEDS.txt",
  "product_title_(marketing_title_+_normalized_title)": "THE MONSTERS – DRESS BE LATTE Vinyl Plush Doll.",
  "variant_name_(colorway,_pose,_outfit)": "Latte shades with furry bucket hat, knit shirt, scarf, pants, shoulder bag, shoes.",
  "deterministic_product_id_components": "Unknown.",
  "aliases_\\&_search_tokens_(en/中文;_common_misspellings)": "Dress be Latte Labubu, 拉布布拿铁装扮 (inferred from series context).",
  "parent/child_relations_(reissue,_seasonal_of_core,_collab_of_core)": "Core variant in The Monsters universe, fall-winter seasonal theme, no direct reissue noted[^2_1][^2_2].",
  "size_(h/w/d_in_cm)": "Approximately 38 cm height (inferred from series standards).",
  "weight_(grams)": "Unknown.",
  "finish_(matte,_flocked,_metallic,_translucent)": "Soft fluffy plush with vinyl elements.",
  "articulation/motion": "Unknown.",
  "accessories_in_box": "None specified.",
  "colorway_notes": "Latte-toned outfit with fluffy accents[^2_2][^2_10][^2_11].",
  "packaging_dimensions_\\&_weight": "Unknown.",
  "box_contents_bill": "Plush doll.",
  "authenticity/anti-counterfeit_marker": "QR code (inferred).",
  "factory/qa_code": "Unknown[^2_1].",
  "edition.kind": "Standard edition.",
  "edition_size_(unit_count)": "Unknown.",
  "chase/rarity_ratio": "Not applicable (non-blind box).",
  "staff/member_perks": "Unknown.",
  "original_designer/artist_(en_\\&_中文)": "Kasing Lung (龙家升).",
  "sculpt/model_credits": "Unknown.",
  "collaboration_partner": "None.",
  "licensing_owner": "POP MART[^2_1][^2_6].",
  "announced_date": "Unknown.",
  "release_date_(authoritative;_log_deltas_if_contradicted)": "2023-10-27.",
  "drop_windows_(channels)": "POP MART official online store, global sites.",
  "purchase_limits": "Unknown.",
  "queues/mechanics": "Sold out quickly.",
  "restock/second_wave_dates": "Unknown.",
  "end-of-life_or_“sold_out”_date": "Sold out upon release[^2_1][^2_10][^2_12].",
  "region_lock_(true/false;_explanation)": "False; available internationally.",
  "regional_codes_involved": "US, CN, global.",
  "packaging/regulatory_differences": "Unknown[^2_1].",
  "region_code": "CN.",
  "channel": "POP MART official site.",
  "launch_msrp_(currency_+_numeric)": "CNY499.",
  "subsequent_official_price_changes": "Unknown.",
  "stock_status_snapshots": "Sold out, reseller prices up to \\$486.",
  "purchase_limit_at_listing": "Unknown[^2_1][^2_2][^2_10].",
  "age_rating": "Not suitable for persons under 15.",
  "warnings": "Unknown.",
  "compliance_marks": "Unknown.",
  "hs/customs_category": "Unknown[^2_10][^2_11].",
  "sku/model_code": "Unknown.",
  "barcode/ean/upc": "Unknown.",
  "shipping_box_info": "Unknown.",
  "return_policy_excerpt": "Standard returns.",
  "warranty/support_link": "Unknown.",
  "hero_image(s)": "Labubu in latte outfit.",
  "orthographic_angles": "Front views.",
  "packaging_flats": "Color box.",
  "icon/thumb": "Unknown.",
  "videos": "Unboxing.",
  "image_rights_note": "Official assets.",
  "asset_hashes": "Unknown[^2_2][^2_12][^2_13].",
  "primary_sources_used": "POP MART site, Instagram.",
  "secondary_sources_used": "Fig Palace, Blindboxmall.",
  "capture_artifacts_(retrieved_at,_hash)": "Retrieved 2025-08-13; hashes unknown.",
  "contradiction_log_(deltas)": "Release date adjusted to 2023-10-27 from seed's 2023-10-26.",
  "query_ledger_(top_6–10_queries)": "\"Pop Mart Dress be Latte plush 2023 release\", \"Pop Mart Dress be Latte plush 2023 price\", \"Pop Mart Dress be Latte plush 2023 physical specifications\", \"Pop Mart Dress be Latte variants\", \"Pop Mart Dress be Latte materials\", \"Pop Mart Dress be Latte packaging\", \"Pop Mart Dress be Latte edition size\", \"Pop Mart Dress be Latte credits\".",
  "localized_titles": "Dress be Latte (EN), 拿铁装扮 (CN, inferred).",
  "transliteration_notes": "Labubu as 拉布布.",
  "per-locale_notes": "English and Chinese[^2_1].",
  "predecessor/successor": "Part of The Monsters series.",
  "lateral_variants": "Jump for Joy, other plush.",
  "same_sculpt/different_finish": "Similar format.",
  "shared_collab_capsule": "None.",
  "series_hub_link": "POP MART collection[^2_1].",
  "official_price_history_timeline": "Launched at CNY499, resellers at \\$486.",
  "secondary_market_range_snapshots": "High secondary prices.",
  "scarcity_signals": "Sold out, collectible demand[^2_1][^2_2][^2_10][^2_13].",
  "https": "//fr.pinterest.com/pin/the-monsters-dress-be-latte-vinyl-plush-doll--418412621656709921/",
  "<div_style=\"text-align": "center\">⁂</div>"
}
