{
  "title": "Let’s Checkmate (Doll)",
  "date": "2025-02-07",
  "price": "USD 114.99",
  "body": "Identity \\& taxonomy:\nBrand: POP MART.\nLine: The Monsters.\nCharacter: Labubu.\nSeries: Let’s Checkmate.\nProduct title (marketing title + normalized title): THE MONSTERS Let’s Checkmate Series-Vinyl Plush Doll.\nVariant name (colorway, pose, outfit): Brown fur with crown, white ruffle collar, red cape with white fur trim, holding ring box.\nForm: Vinyl plush doll.\nDeterministic product_id components: Unknown.\nAliases \\& search tokens (EN/中文; common misspellings): Let’s Checkmate Labubu Doll, 拉布布让我们对弈 (inferred from series context).\nParent/child relations (reissue, seasonal of core, collab of core): Core variant in The Monsters universe, paired with hanging card version, no direct reissue noted.\nPhysical spec:\nSize (h/w/d in cm): 37cm height.\nWeight (grams): Unknown.\nMaterials: Shell-Polyester/PVC/ABS; Stuffing-Polyester/PP Particles; Ring Box-PS/Polyester/Hardware.\nFinish (matte, flocked, metallic, translucent): Soft plush body with vinyl face.\nArticulation/motion: Movable eyes.\nAccessories in box: Removable cape, functional ring box (empty).\nColorway notes: Brown fur with red cape and white accents.\nPackaging \\& in-box contents:\nPackaging type: Color box.\nPackaging dimensions \\& weight: Unknown.\nBox contents bill: Plush doll, cape, ring box, authenticity card (inferred from series standards).\nAuthenticity/anti-counterfeit marker: QR code for verification (inferred).\nFactory/QA code: Unknown.\nEdition \\& run info:\nEdition.kind: Standard edition.\nEdition size (unit_count): Unknown.\nChase/rarity ratio: Not applicable (non-blind box).\nStaff/member perks: Unknown.\nCredits:\nOriginal designer/artist (EN \\& 中文): Kasing Lung (龙家升).\nSculpt/model credits: POP MART design team.\nCollaboration partner: None.\nLicensing owner: POP MART.\nRelease \\& distribution:\nAnnounced date: Unknown.\nRelease date (authoritative; log deltas if contradicted): 2025-02-07.\nDrop windows (channels): POP MART official online store, global sites.\nPurchase limits: Limited to 1 piece per customer in some channels.\nQueues/mechanics: High demand, first come first served.\nRestock/second wave dates: Unknown.\nEnd-of-life or “sold out” date: Unknown.\nRegional policy:\nRegion_lock (true/false; explanation): False; available internationally via POP MART sites.\nRegional codes involved: US, CN, global.\nPackaging/regulatory differences: Unknown.\nMarket listings (per region/channel):\nRegion code: US.\nChannel: POP MART official site.\nLaunch MSRP (currency + numeric): USD114.99.\nSubsequent official price changes: Unknown.\nStock status snapshots: Sold out quickly upon release.\nPurchase limit at listing: 1 per customer.\nBlind-box specifics (if relevant):\nNot applicable (single plush doll, not blind box).\nCompliance \\& safety:\nAge rating: Not suitable for persons under 15.\nWarnings: Unknown.\nCompliance marks: Unknown.\nHS/customs category: Unknown.\nCommerce \\& logistics adjuncts:\nSKU/model code: Unknown.\nBarcode/EAN/UPC: Unknown.\nShipping box info: Unknown.\nReturn policy excerpt: 15-day returns (inferred from brand standards).\nWarranty/support link: Unknown.\nMedia \\& assets:\nHero image(s): Labubu in crown and cape holding ring box.\nOrthographic angles: Front and side views.\nPackaging flats: Color box with artwork.\nIcon/thumb: Unknown.\nVideos: Unboxing and review videos.\nImage rights note: Official POP MART assets.\nAsset hashes: Unknown.\nProvenance \\& research trace:\nPrimary sources used: POP MART official site, Instagram.\nSecondary sources used: Fig Palace, YouTube reviews, Reddit.\nCapture artifacts (retrieved_at, hash): Retrieved 2025-08-13; hashes unknown.\nContradiction log (deltas): No deltas on release date or MSRP.\nQuery ledger (top 6–10 queries): \"POP MART Let’s Checkmate Doll 2025 release date\", \"POP MART Let’s Checkmate Doll vinyl plush USD 114.99\", \"POP MART Let’s Checkmate Doll physical specifications\", \"POP MART Let’s Checkmate Doll materials\", \"POP MART Let’s Checkmate Doll packaging\", \"POP MART Let’s Checkmate Doll edition size\", \"POP MART Let’s Checkmate Doll credits\", \"POP MART Let’s Checkmate Doll regional policy\".\ni18n \\& nomenclature:\nLocalized titles: Let’s Checkmate (EN), 让我们对弈 (CN, inferred).\nTransliteration notes: Labubu as 拉布布.\nPer-locale notes: English and Chinese marketing.\nRelations \\& graph edges:\nPredecessor/successor: Part of ongoing The Monsters series.\nLateral variants: Paired with Let’s Checkmate Hanging Card.\nSame sculpt/different finish: Similar vinyl plush format to other series.\nShared collab capsule: None.\nSeries hub link: POP MART The Monsters collection.\nMarket intelligence (optional):\nOfficial price history timeline: Launched at USD114.99.\nSecondary market range snapshots: Unknown.\nScarcity signals: High demand, limited per customer.\nProvenance URLs:\nhttps://m.popmart.com/us/products/1898/the-monsters-let-s-checkmate-series-vinyl-plush-doll\nhttps://figpalace.com/blogs/guide/labubu-zimomo-mokoko-series-list\nhttps://shoegamemanila.myshopify.com/products/pop-mart-the-monsters-lets-checkmate-series-vinyl-plush-hanging-card\nhttps://www.reddit.com/r/labubuworld/comments/1mosrhe/pop_mart_the_monsters_lets_checkmate_seriesvinyl/\nhttps://www.instagram.com/p/DFnkY-Lixoa/?hl=en\nhttps://www.youtube.com/watch?v=XAv0Z9B40Lo\nhttps://www.instagram.com/reel/DFTSwyAI7KE/\nhttps://www.instagram.com/p/DGEwGHyBLZV/\nDeltas: None.",
  "deltas": "None.",
  "source": "COMPLETED SEEDS.txt",
  "brand": "POP MART.",
  "line": "The Monsters.",
  "character": "Labubu.",
  "series": "Let’s Checkmate.",
  "product_title_(marketing_title_+_normalized_title)": "THE MONSTERS Let’s Checkmate Series-Vinyl Plush Doll.",
  "variant_name_(colorway,_pose,_outfit)": "Brown fur with crown, white ruffle collar, red cape with white fur trim, holding ring box.",
  "form": "Vinyl plush doll.",
  "deterministic_product_id_components": "Unknown.",
  "aliases_\\&_search_tokens_(en/中文;_common_misspellings)": "Let’s Checkmate Labubu Doll, 拉布布让我们对弈 (inferred from series context).",
  "parent/child_relations_(reissue,_seasonal_of_core,_collab_of_core)": "Core variant in The Monsters universe, paired with hanging card version, no direct reissue noted.",
  "size_(h/w/d_in_cm)": "37cm height.",
  "weight_(grams)": "Unknown.",
  "materials": "Shell-Polyester/PVC/ABS; Stuffing-Polyester/PP Particles; Ring Box-PS/Polyester/Hardware.",
  "finish_(matte,_flocked,_metallic,_translucent)": "Soft plush body with vinyl face.",
  "articulation/motion": "Movable eyes.",
  "accessories_in_box": "Removable cape, functional ring box (empty).",
  "colorway_notes": "Brown fur with red cape and white accents.",
  "packaging_type": "Color box.",
  "packaging_dimensions_\\&_weight": "Unknown.",
  "box_contents_bill": "Plush doll, cape, ring box, authenticity card (inferred from series standards).",
  "authenticity/anti-counterfeit_marker": "QR code for verification (inferred).",
  "factory/qa_code": "Unknown.",
  "edition.kind": "Standard edition.",
  "edition_size_(unit_count)": "Unknown.",
  "chase/rarity_ratio": "Not applicable (non-blind box).",
  "staff/member_perks": "Unknown.",
  "original_designer/artist_(en_\\&_中文)": "Kasing Lung (龙家升).",
  "sculpt/model_credits": "POP MART design team.",
  "collaboration_partner": "None.",
  "licensing_owner": "POP MART.",
  "announced_date": "Unknown.",
  "release_date_(authoritative;_log_deltas_if_contradicted)": "2025-02-07.",
  "drop_windows_(channels)": "POP MART official online store, global sites.",
  "purchase_limits": "Limited to 1 piece per customer in some channels.",
  "queues/mechanics": "High demand, first come first served.",
  "restock/second_wave_dates": "Unknown.",
  "end-of-life_or_“sold_out”_date": "Unknown.",
  "region_lock_(true/false;_explanation)": "False; available internationally via POP MART sites.",
  "regional_codes_involved": "US, CN, global.",
  "packaging/regulatory_differences": "Unknown.",
  "region_code": "US.",
  "channel": "POP MART official site.",
  "launch_msrp_(currency_+_numeric)": "USD114.99.",
  "subsequent_official_price_changes": "Unknown.",
  "stock_status_snapshots": "Sold out quickly upon release.",
  "purchase_limit_at_listing": "1 per customer.",
  "age_rating": "Not suitable for persons under 15.",
  "warnings": "Unknown.",
  "compliance_marks": "Unknown.",
  "hs/customs_category": "Unknown.",
  "sku/model_code": "Unknown.",
  "barcode/ean/upc": "Unknown.",
  "shipping_box_info": "Unknown.",
  "return_policy_excerpt": "15-day returns (inferred from brand standards).",
  "warranty/support_link": "Unknown.",
  "hero_image(s)": "Labubu in crown and cape holding ring box.",
  "orthographic_angles": "Front and side views.",
  "packaging_flats": "Color box with artwork.",
  "icon/thumb": "Unknown.",
  "videos": "Unboxing and review videos.",
  "image_rights_note": "Official POP MART assets.",
  "asset_hashes": "Unknown.",
  "primary_sources_used": "POP MART official site, Instagram.",
  "secondary_sources_used": "Fig Palace, YouTube reviews, Reddit.",
  "capture_artifacts_(retrieved_at,_hash)": "Retrieved 2025-08-13; hashes unknown.",
  "contradiction_log_(deltas)": "No deltas on release date or MSRP.",
  "query_ledger_(top_6–10_queries)": "\"POP MART Let’s Checkmate Doll 2025 release date\", \"POP MART Let’s Checkmate Doll vinyl plush USD 114.99\", \"POP MART Let’s Checkmate Doll physical specifications\", \"POP MART Let’s Checkmate Doll materials\", \"POP MART Let’s Checkmate Doll packaging\", \"POP MART Let’s Checkmate Doll edition size\", \"POP MART Let’s Checkmate Doll credits\", \"POP MART Let’s Checkmate Doll regional policy\".",
  "localized_titles": "Let’s Checkmate (EN), 让我们对弈 (CN, inferred).",
  "transliteration_notes": "Labubu as 拉布布.",
  "per-locale_notes": "English and Chinese marketing.",
  "predecessor/successor": "Part of ongoing The Monsters series.",
  "lateral_variants": "Paired with Let’s Checkmate Hanging Card.",
  "same_sculpt/different_finish": "Similar vinyl plush format to other series.",
  "shared_collab_capsule": "None.",
  "series_hub_link": "POP MART The Monsters collection.",
  "official_price_history_timeline": "Launched at USD114.99.",
  "secondary_market_range_snapshots": "Unknown.",
  "scarcity_signals": "High demand, limited per customer.",
  "https": "//www.instagram.com/p/DGEwGHyBLZV/",
  "Deltas": []
}
