{
  "brand": "POP MART.",
  "line": "The Monsters.",
  "character": "Labubu.",
  "series": "Best of Luck (海外限定/Overseas Exclusive).",
  "product_title": "Best of Luck（海外限定）",
  "variant_name": "Purple fur with gold rope motifs, yellow toes, starry face accents, fashion week inspired outfit",
  "form": "Vinyl plush doll.",
  "product_code": "Unknown",
  "size_cm": "38cm tall / 14.9 inches",
  "materials": "Polyester Fiber/PVC/ABS; Filling: 100% Polyester Fiber.",
  "packaging_type": "Color box.",
  "edition_kind": "Limited overseas exclusive edition",
  "release_date": "2023-12-30",
  "msrp": 499,
  "currency": "CNY",
  "url": "https://figpalace.com/blogs/guide/labubu-zimomo-mokoko-series-list",
  "Deltas": [],
  "title": "Best of Luck（海外限定）",
  "msrp_currency": "CNY",
  "product_id": "SKU 1505",
  "size": "38 cm height",
  "weight": 1.5,
  "finish": "Flocked plush body with vinyl face",
  "articulation": "None",
  "deltas": "None.",
  "date": "2023-12-30",
  "price": "CNY 499",
  "body": "Identity \\& taxonomy:\nBrand: POP MART.\nLine: The Monsters.\nCharacter: Labubu.\nSeries: Best of Luck (海外限定/Overseas Exclusive).\nProduct title (marketing title + normalized title): THE MONSTERS – BEST OF LUCK Vinyl Plush Doll.\nVariant name (colorway, pose, outfit): Chinese New Year theme with cream/beige outfit, casual sweater, pants, and shoes (all removable).\nForm: Vinyl plush doll.\nDeterministic product_id components: Unknown.\nAliases \\& search tokens (EN/中文; common misspellings): Best of Luck Labubu, 拉布布好运连连 (inferred from series context).\nParent/child relations (reissue, seasonal of core, collab of core): Limited seasonal edition for overseas markets, paired with Walk by Fortune, no direct reissue noted.\nPhysical spec:\nSize (h/w/d in cm): 38cm tall / 14.9 inches.\nWeight (grams): Unknown.\nMaterials: Polyester Fiber/PVC/ABS; Filling: 100% Polyester Fiber.\nFinish (matte, flocked, metallic, translucent): Soft plush body with vinyl face.\nArticulation/motion: Removable clothes and shoes.\nAccessories in box: Removable sweater, pants, casual shoes.\nColorway notes: Cream/beige colored outfit with casual streetwear styling.\nPackaging \\& in-box contents:\nPackaging type: Color box.\nPackaging dimensions \\& weight: Unknown.\nBox contents bill: Plush doll with removable outfit, authenticity card (inferred).\nAuthenticity/anti-counterfeit marker: QR code (inferred).\nFactory/QA code: Unknown.\nEdition \\& run info:\nEdition.kind: Limited overseas exclusive edition.\nEdition size (unit_count): 3,000 units.\nChase/rarity ratio: Not applicable (limited quantity, non-blind box).\nStaff/member perks: Unknown.\nCredits:\nOriginal designer/artist (EN \\& 中文): Kasing Lung (龙家升).\nSculpt/model credits: POP MART design team.\nCollaboration partner: None.\nLicensing owner: POP MART.\nRelease \\& distribution:\nAnnounced date: Unknown.\nRelease date (authoritative; log deltas if contradicted): December 30, 2023.\nDrop windows (channels): POP MART official online store, overseas markets primarily.\nPurchase limits: Unknown.\nQueues/mechanics: Limited to 3,000 units, customer screening required.\nRestock/second wave dates: No restocks due to limited edition nature.\nEnd-of-life or \"sold out\" date: Sold out quickly due to limited quantity.\nRegional policy:\nRegion_lock (true/false; explanation): True; designated as overseas exclusive (海外限定).\nRegional codes involved: Overseas markets (non-CN).\nPackaging/regulatory differences: CE certification for overseas markets.\nMarket listings (per region/channel):\nRegion code: Overseas.\nChannel: POP MART official sites (overseas).\nLaunch MSRP (currency + numeric): CNY499.\nSubsequent official price changes: Unknown.\nStock status snapshots: Sold out, reseller prices up to USD1,808.51.\nPurchase limit at listing: Customer screening required.\nBlind-box specifics (if relevant):\nNot applicable (single limited edition plush doll, not blind box).\nCompliance \\& safety:\nAge rating: Not suitable for persons under 15.\nWarnings: Unknown.\nCompliance marks: CE certification.\nHS/customs category: Unknown.\nCommerce \\& logistics adjuncts:\nSKU/model code: Unknown.\nBarcode/EAN/UPC: Unknown.\nShipping box info: Unknown.\nReturn policy excerpt: 15-day returns, no returns/refunds after confirmed orders.\nWarranty/support link: Unknown.\nMedia \\& assets:\nHero image(s): Labubu in cream/beige casual outfit.\nOrthographic angles: Front views with removable clothing details.\nPackaging flats: Color box.\nIcon/thumb: Unknown.\nVideos: Unboxing videos.\nImage rights note: Official POP MART assets.\nAsset hashes: Unknown.\nProvenance \\& research trace:\nPrimary sources used: POP MART official sites, Fig Palace.\nSecondary sources used: Hypebrother, collector sites, Pinterest.\nCapture artifacts (retrieved_at, hash): Retrieved 2025-08-13; hashes unknown.\nContradiction log (deltas): No deltas on release date or MSRP.\nQuery ledger (top 6–10 queries): \"POP MART Best of Luck 海外限定 2023 limited 3000\", \"POP MART Best of Luck overseas exclusive CNY 499 specifications\", \"POP MART Best of Luck materials packaging\", \"POP MART Best of Luck edition size\", \"POP MART Best of Luck credits\", \"POP MART Best of Luck regional policy\", \"POP MART Best of Luck removable clothes\", \"POP MART Best of Luck physical specifications\".\ni18n \\& nomenclature:\nLocalized titles: Best of Luck (EN), 好运连连 (CN, inferred).\nTransliteration notes: Labubu as 拉布布.\nPer-locale notes: Overseas exclusive marking (海外限定).\nRelations \\& graph edges:\nPredecessor/successor: Part of seasonal CNY collection.\nLateral variants: Paired with Walk by Fortune (CNY).\nSame sculpt/different finish: Similar limited edition format with removable clothing.\nShared collab capsule: Chinese New Year 2024 theme.\nSeries hub link: POP MART seasonal exclusives.\nMarket intelligence (optional):\nOfficial price history timeline: Launched at CNY499, reseller prices up to USD1,808.51.\nSecondary market range snapshots: Extremely high secondary market value due to overseas exclusive and limited edition nature.\nScarcity signals: Limited to 3,000 units, overseas exclusive, customer screening required, immediate sellout.\nProvenance URLs:\nhttps://figpalace.com/blogs/guide/labubu-zimomo-mokoko-series-list\nhttps://www.hypebrother.com/product-toy-popmart-labubu-best-of-luck.html\nhttps://www.pinterest.com/pin/the-monsters-best-of-luck-vinyl-plush-dollpop-martunited-states--590393832444909943/\nhttps://www.popmart.com/us/products/890/the-monsters-best-of-luck-vinyl-plush-doll\nhttps://gadgetsforyou.net/products/pop-mart-the-monsters-labubu-best-of-luck-vinyl-plush-doll\nhttps://labubucollector.com/labubu-release-date/\nhttps://www.kicksown.com/products/pop-mart-the-monsters-best-of-luck-trendy-figures\nhttps://www.popmart.com/nl/products/652/the-monsters-best-of-luck-vinyl-plush-doll\nDeltas: None.\nUPDATED CURRENT QUEUE\nHappy Halloween Party — 2024-10-25; AU\\$ 50 (keychain pendant)\nPRONOUNCE — Be Fancy Now — 2024-03-15; CNY 599; limited 6,458\nPRONOUNCE — Wings of Fantasy (plush) / Wings of Fortune (hanging card) — 2024-10-04; USD 119.99 / USD 43.99\nCoca-Cola — 2025-01-24; 15.5×17 cm; set USD 239.94 / box USD 39.99 (blind box)\nExciting Macaron (v1) — 2024-10-27; set USD 131.94 / box USD 21.99\nHave a Seat — 2024-07-12; 8×7×15 cm; set USD 131.94 / box USD 21.99\nBig Into Energy (v3) — 2025-04-25; 17 cm; set USD 167.94 / box USD 27.99\nI FOUND YOU (v1) — 2023-12-15; 30×25×58 cm; USD 179.99\nANGEL IN CLOUDS (v2) — 2024-10-25; 33×25×58 cm; USD 289.99\nClose to Sweet (v1) — 2023-09-xx; plush vs pendant (split by form)\nFall into Spring — 2024-03-08; CNY 599 (plush) / CNY 159 (pendant)\nBlue Diamond — 2024-06-18; CNY 159 (pendant)\nMagic of Pumpkin (Halloween) — 2024-10-27; CNY 159 (pendant)\nTwinkly Fairy Tale — 2024-11-28; CNY 159 (pendant)\nHide and Seek in Singapore — S\\$37.90; 10×10×17.5 cm; reg-sg expected\nGOOD LUCKY TO YOU (Thailand) — THB 1,050; 2024-12-20; reg-th expected\nForest Fairy Tale (China) — 2025-05-26; member points; reg-cn expected\nWacky Mart (China) — 2025-06-12; CNY 199; reg-cn expected\n<div style=\"text-align: center\">⁂</div>\nCOMPLETED SEEDS",
  "source": "COMPLETED SEEDS.txt",
  "product_title_(marketing_title_+_normalized_title)": "THE MONSTERS – BEST OF LUCK Vinyl Plush Doll.",
  "variant_name_(colorway,_pose,_outfit)": "Chinese New Year theme with cream/beige outfit, casual sweater, pants, and shoes (all removable).",
  "deterministic_product_id_components": "Unknown.",
  "aliases_\\&_search_tokens_(en/中文;_common_misspellings)": "Best of Luck Labubu, 拉布布好运连连 (inferred from series context).",
  "parent/child_relations_(reissue,_seasonal_of_core,_collab_of_core)": "Limited seasonal edition for overseas markets, paired with Walk by Fortune, no direct reissue noted.",
  "size_(h/w/d_in_cm)": "38cm tall / 14.9 inches.",
  "weight_(grams)": "Unknown.",
  "finish_(matte,_flocked,_metallic,_translucent)": "Soft plush body with vinyl face.",
  "articulation/motion": "Removable clothes and shoes.",
  "accessories_in_box": "Removable sweater, pants, casual shoes.",
  "colorway_notes": "Cream/beige colored outfit with casual streetwear styling.",
  "packaging_dimensions_\\&_weight": "Unknown.",
  "box_contents_bill": "Plush doll with removable outfit, authenticity card (inferred).",
  "authenticity/anti-counterfeit_marker": "QR code (inferred).",
  "factory/qa_code": "Unknown.",
  "edition.kind": "Limited overseas exclusive edition.",
  "edition_size_(unit_count)": "3,000 units.",
  "chase/rarity_ratio": "Not applicable (limited quantity, non-blind box).",
  "staff/member_perks": "Unknown.",
  "original_designer/artist_(en_\\&_中文)": "Kasing Lung (龙家升).",
  "sculpt/model_credits": "POP MART design team.",
  "collaboration_partner": "None.",
  "licensing_owner": "POP MART.",
  "announced_date": "Unknown.",
  "release_date_(authoritative;_log_deltas_if_contradicted)": "December 30, 2023.",
  "drop_windows_(channels)": "POP MART official online store, overseas markets primarily.",
  "purchase_limits": "Unknown.",
  "queues/mechanics": "Limited to 3,000 units, customer screening required.",
  "restock/second_wave_dates": "No restocks due to limited edition nature.",
  "end-of-life_or_\"sold_out\"_date": "Sold out quickly due to limited quantity.",
  "region_lock_(true/false;_explanation)": "True; designated as overseas exclusive (海外限定).",
  "regional_codes_involved": "Overseas markets (non-CN).",
  "packaging/regulatory_differences": "CE certification for overseas markets.",
  "region_code": "Overseas.",
  "channel": "POP MART official sites (overseas).",
  "launch_msrp_(currency_+_numeric)": "CNY499.",
  "subsequent_official_price_changes": "Unknown.",
  "stock_status_snapshots": "Sold out, reseller prices up to USD1,808.51.",
  "purchase_limit_at_listing": "Customer screening required.",
  "age_rating": "Not suitable for persons under 15.",
  "warnings": "Unknown.",
  "compliance_marks": "CE certification.",
  "hs/customs_category": "Unknown.",
  "sku/model_code": "Unknown.",
  "barcode/ean/upc": "Unknown.",
  "shipping_box_info": "Unknown.",
  "return_policy_excerpt": "15-day returns, no returns/refunds after confirmed orders.",
  "warranty/support_link": "Unknown.",
  "hero_image(s)": "Labubu in cream/beige casual outfit.",
  "orthographic_angles": "Front views with removable clothing details.",
  "packaging_flats": "Color box.",
  "icon/thumb": "Unknown.",
  "videos": "Unboxing videos.",
  "image_rights_note": "Official POP MART assets.",
  "asset_hashes": "Unknown.",
  "primary_sources_used": "POP MART official sites, Fig Palace.",
  "secondary_sources_used": "Hypebrother, collector sites, Pinterest.",
  "capture_artifacts_(retrieved_at,_hash)": "Retrieved 2025-08-13; hashes unknown.",
  "contradiction_log_(deltas)": "No deltas on release date or MSRP.",
  "query_ledger_(top_6–10_queries)": "\"POP MART Best of Luck 海外限定 2023 limited 3000\", \"POP MART Best of Luck overseas exclusive CNY 499 specifications\", \"POP MART Best of Luck materials packaging\", \"POP MART Best of Luck edition size\", \"POP MART Best of Luck credits\", \"POP MART Best of Luck regional policy\", \"POP MART Best of Luck removable clothes\", \"POP MART Best of Luck physical specifications\".",
  "localized_titles": "Best of Luck (EN), 好运连连 (CN, inferred).",
  "transliteration_notes": "Labubu as 拉布布.",
  "per-locale_notes": "Overseas exclusive marking (海外限定).",
  "predecessor/successor": "Part of seasonal CNY collection.",
  "lateral_variants": "Paired with Walk by Fortune (CNY).",
  "same_sculpt/different_finish": "Similar limited edition format with removable clothing.",
  "shared_collab_capsule": "Chinese New Year 2024 theme.",
  "series_hub_link": "POP MART seasonal exclusives.",
  "official_price_history_timeline": "Launched at CNY499, reseller prices up to USD1,808.51.",
  "secondary_market_range_snapshots": "Extremely high secondary market value due to overseas exclusive and limited edition nature.",
  "scarcity_signals": "Limited to 3,000 units, overseas exclusive, customer screening required, immediate sellout.",
  "https": "//www.popmart.com/nl/products/652/the-monsters-best-of-luck-vinyl-plush-doll",
  "<div_style=\"text-align": "center\">⁂</div>"
}