{
  "brand": "POP MART.",
  "line": "The Monsters.",
  "character": "Labubu.",
  "series": "Flip with Me.",
  "product_title": "Flip with Me",
  "variant_name": "Blue and white striped button-down shirt, dark denim jeans, black and white sneakers, glasses",
  "form": "Vinyl plush doll.",
  "product_code": "12401040004",
  "size_cm": "20×15×40cm / 7.87×5.91×15.75 inches",
  "materials": "SHELL: 40% Cotton, 17% PVC, 16% Polyester, 15% ABS, 12% TPR; STUFFING: 90% Polyester, 10% PE Particles.",
  "packaging_type": "Color box with handle.",
  "edition_kind": "Standard edition",
  "release_date": "2024-07-12",
  "msrp": 114.99,
  "currency": "USD",
  "url": "https://m.popmart.com/us/products/1371/the-monsters-flip-with-me-vinyl-plush-doll",
  "Deltas": [],
  "title": "Flip with Me",
  "date": "2024-07-12",
  "price": "USD 114.99, CAD 134.99",
  "body": "Identity \\& taxonomy:\nBrand: POP MART.\nLine: The Monsters.\nCharacter: Labubu.\nSeries: Flip with Me.\nProduct title (marketing title + normalized title): THE MONSTERS – FLIP WITH ME Vinyl Plush Doll.\nVariant name (colorway, pose, outfit): Blue and white striped button-down shirt, dark denim jeans, black and white sneakers, glasses.\nForm: Vinyl plush doll.\nDeterministic product_id components: SKU 12401040004.\nAliases \\& search tokens (EN/中文; common misspellings): Flip with Me Labubu, 拉布布翻转和我一起 (inferred from series context).\nParent/child relations (reissue, seasonal of core, collab of core): Core variant in The Monsters universe, no direct reissue noted.\nPhysical spec:\nSize (h/w/d in cm): 20×15×40cm / 7.87×5.91×15.75 inches.\nWeight (grams): Unknown.\nMaterials: SHELL: 40% Cotton, 17% PVC, 16% Polyester, 15% ABS, 12% TPR; STUFFING: 90% Polyester, 10% PE Particles.\nFinish (matte, flocked, metallic, translucent): Soft plush body with vinyl face and articulated features.\nArticulation/motion: Movable eyes with flip feature (spiral eyes), posable hands and head.\nAccessories in box: Removable glasses.\nColorway notes: Tan plush fur with blue striped shirt and denim pants.\nPackaging \\& in-box contents:\nPackaging type: Color box with handle.\nPackaging dimensions \\& weight: Single package size: 30×22×45 cm; Single gross weight: 5.000 KG.\nBox contents bill: Plush doll, glasses accessory, authenticity card.\nAuthenticity/anti-counterfeit marker: Zip ties, batch verification.\nFactory/QA code: Unknown.\nEdition \\& run info:\nEdition.kind: Standard edition.\nEdition size (unit_count): Unknown.\nChase/rarity ratio: Not applicable (non-blind box).\nStaff/member perks: Unknown.\nCredits:\nOriginal designer/artist (EN \\& 中文): Kasing Lung (龙家升).\nSculpt/model credits: POP MART design team.\nCollaboration partner: None.\nLicensing owner: POP MART.\nRelease \\& distribution:\nAnnounced date: July 7, 2024.\nRelease date (authoritative; log deltas if contradicted): July 12, 2024.\nDrop windows (channels): POP MART official online store, global sites, in-store only in some regions.\nPurchase limits: Limited to 2 pieces per order in some channels.\nQueues/mechanics: High demand, frequent sellouts.\nRestock/second wave dates: August 9, 2024 in-store availability.\nEnd-of-life or \"sold out\" date: Frequently sold out.\nRegional policy:\nRegion_lock (true/false; explanation): False; available internationally via POP MART sites.\nRegional codes involved: US, CA, CN, global.\nPackaging/regulatory differences: Unknown.\nMarket listings (per region/channel):\nRegion code: US.\nChannel: POP MART official site.\nLaunch MSRP (currency + numeric): USD114.99.\nRegion code: CA.\nChannel: POP MART official site.\nLaunch MSRP (currency + numeric): CAD134.99.\nSubsequent official price changes: Unknown.\nStock status snapshots: Sold out, reseller prices ranging from USD182–USD226.\nPurchase limit at listing: Limited to 2 pieces per order.\nBlind-box specifics (if relevant):\nNot applicable (single plush doll, not blind box).\nCompliance \\& safety:\nAge rating: Not suitable for persons under 15.\nWarnings: Unknown.\nCompliance marks: California Proposition 65 Consumer Warning.\nHS/customs category: Unknown.\nCommerce \\& logistics adjuncts:\nSKU/model code: 12401040004.\nBarcode/EAN/UPC: Unknown.\nShipping box info: 30×22×45 cm packaging.\nReturn policy excerpt: 15-day returns.\nWarranty/support link: Unknown.\nMedia \\& assets:\nHero image(s): Labubu in office outfit with glasses.\nOrthographic angles: Front views with flip eye feature.\nPackaging flats: Color box with handle design.\nIcon/thumb: Unknown.\nVideos: Multiple unboxing and review videos.\nImage rights note: Official POP MART assets.\nAsset hashes: Unknown.\nProvenance \\& research trace:\nPrimary sources used: POP MART official sites (US, CA), Instagram.\nSecondary sources used: Hypevault, YouTube reviews, Alibaba listings.\nCapture artifacts (retrieved_at, hash): Retrieved 2025-08-13; hashes unknown.\nContradiction log (deltas): No deltas on release date or MSRP.\nQuery ledger (top 6–10 queries): \"POP MART The Monsters Flip with Me 2024 plush release\", \"POP MART The Monsters Flip with Me 2024 price specifications\", \"POP MART Flip with Me Let's Checkmate 2025 release\", \"POP MART Flip with Me pricing CN US specifications\", \"POP MART The Monsters Flip with Me materials\", \"POP MART The Monsters Flip with Me packaging\".\ni18n \\& nomenclature:\nLocalized titles: Flip with Me (EN), 翻转和我一起 (CN, inferred).\nTransliteration notes: Labubu as 拉布布.\nPer-locale notes: English and Chinese marketing.\nRelations \\& graph edges:\nPredecessor/successor: Part of ongoing The Monsters series.\nLateral variants: Let's Checkmate, Fall in Wild, other vinyl plush.\nSame sculpt/different finish: Similar vinyl plush format to other series.\nShared collab capsule: None.\nSeries hub link: POP MART The Monsters collection.\nMarket intelligence (optional):\nOfficial price history timeline: Launched at USD114.99/CAD134.99, reseller prices USD182–USD226.\nSecondary market range snapshots: High secondary market demand at 60-98% markup.\nScarcity signals: Frequent sellouts, limited per-order quantities.\nProvenance URLs:\nhttps://m.popmart.com/us/products/1371/the-monsters-flip-with-me-vinyl-plush-doll\nhttps://stealplug.com.my/products/pop-mart-labubu-the-monsters-flip-with-me-vinyl-plush-doll\nhttps://www.instagram.com/p/C9I55UepT-E/?hl=en\nhttps://hypevault.co/products/pop-mart-labubu-the-monsters-flip-with-me-vinyl-plush-doll\nhttps://www.popmart.com/us/products/3106/\nhttps://www.instagram.com/reel/C9LQ99ToFiB/?hl=en\nhttps://x.com/POPMARTGlobal/status/1809170068754116827?lang=en\nhttps://curionest.ca/products/pop-mart-the-monsters-flip-with-me-vinyl-plush-doll-labubu\nhttps://www.alibaba.com/product-detail/AUTHENTIC-POPMART-LABUBU-the-MONSTERS-FLIP_1601397338580.html\nhttps://www.priorstoreofficial.com/zh/products/pop-mart-labubu-the-monsters-flip-with-me-vinyl-plush-doll\nhttps://www.popmart.com/ca/products/1371/the-monsters-flip-with-me-vinyl-plush-doll\nDeltas: None.",
  "deltas": "None.",
  "source": "COMPLETED SEEDS.txt",
  "product_title_(marketing_title_+_normalized_title)": "THE MONSTERS – FLIP WITH ME Vinyl Plush Doll.",
  "variant_name_(colorway,_pose,_outfit)": "Blue and white striped button-down shirt, dark denim jeans, black and white sneakers, glasses.",
  "deterministic_product_id_components": "SKU 12401040004.",
  "aliases_\\&_search_tokens_(en/中文;_common_misspellings)": "Flip with Me Labubu, 拉布布翻转和我一起 (inferred from series context).",
  "parent/child_relations_(reissue,_seasonal_of_core,_collab_of_core)": "Core variant in The Monsters universe, no direct reissue noted.",
  "size_(h/w/d_in_cm)": "20×15×40cm / 7.87×5.91×15.75 inches.",
  "weight_(grams)": "Unknown.",
  "finish_(matte,_flocked,_metallic,_translucent)": "Soft plush body with vinyl face and articulated features.",
  "articulation/motion": "Movable eyes with flip feature (spiral eyes), posable hands and head.",
  "accessories_in_box": "Removable glasses.",
  "colorway_notes": "Tan plush fur with blue striped shirt and denim pants.",
  "packaging_dimensions_\\&_weight": "Single package size: 30×22×45 cm; Single gross weight: 5.000 KG.",
  "box_contents_bill": "Plush doll, glasses accessory, authenticity card.",
  "authenticity/anti-counterfeit_marker": "Zip ties, batch verification.",
  "factory/qa_code": "Unknown.",
  "edition.kind": "Standard edition.",
  "edition_size_(unit_count)": "Unknown.",
  "chase/rarity_ratio": "Not applicable (non-blind box).",
  "staff/member_perks": "Unknown.",
  "original_designer/artist_(en_\\&_中文)": "Kasing Lung (龙家升).",
  "sculpt/model_credits": "POP MART design team.",
  "collaboration_partner": "None.",
  "licensing_owner": "POP MART.",
  "announced_date": "July 7, 2024.",
  "release_date_(authoritative;_log_deltas_if_contradicted)": "July 12, 2024.",
  "drop_windows_(channels)": "POP MART official online store, global sites, in-store only in some regions.",
  "purchase_limits": "Limited to 2 pieces per order in some channels.",
  "queues/mechanics": "High demand, frequent sellouts.",
  "restock/second_wave_dates": "August 9, 2024 in-store availability.",
  "end-of-life_or_\"sold_out\"_date": "Frequently sold out.",
  "region_lock_(true/false;_explanation)": "False; available internationally via POP MART sites.",
  "regional_codes_involved": "US, CA, CN, global.",
  "packaging/regulatory_differences": "Unknown.",
  "region_code": "CA.",
  "channel": "POP MART official site.",
  "launch_msrp_(currency_+_numeric)": "CAD134.99.",
  "subsequent_official_price_changes": "Unknown.",
  "stock_status_snapshots": "Sold out, reseller prices ranging from USD182–USD226.",
  "purchase_limit_at_listing": "Limited to 2 pieces per order.",
  "age_rating": "Not suitable for persons under 15.",
  "warnings": "Unknown.",
  "compliance_marks": "California Proposition 65 Consumer Warning.",
  "hs/customs_category": "Unknown.",
  "sku/model_code": "12401040004.",
  "barcode/ean/upc": "Unknown.",
  "shipping_box_info": "30×22×45 cm packaging.",
  "return_policy_excerpt": "15-day returns.",
  "warranty/support_link": "Unknown.",
  "hero_image(s)": "Labubu in office outfit with glasses.",
  "orthographic_angles": "Front views with flip eye feature.",
  "packaging_flats": "Color box with handle design.",
  "icon/thumb": "Unknown.",
  "videos": "Multiple unboxing and review videos.",
  "image_rights_note": "Official POP MART assets.",
  "asset_hashes": "Unknown.",
  "primary_sources_used": "POP MART official sites (US, CA), Instagram.",
  "secondary_sources_used": "Hypevault, YouTube reviews, Alibaba listings.",
  "capture_artifacts_(retrieved_at,_hash)": "Retrieved 2025-08-13; hashes unknown.",
  "contradiction_log_(deltas)": "No deltas on release date or MSRP.",
  "query_ledger_(top_6–10_queries)": "\"POP MART The Monsters Flip with Me 2024 plush release\", \"POP MART The Monsters Flip with Me 2024 price specifications\", \"POP MART Flip with Me Let's Checkmate 2025 release\", \"POP MART Flip with Me pricing CN US specifications\", \"POP MART The Monsters Flip with Me materials\", \"POP MART The Monsters Flip with Me packaging\".",
  "localized_titles": "Flip with Me (EN), 翻转和我一起 (CN, inferred).",
  "transliteration_notes": "Labubu as 拉布布.",
  "per-locale_notes": "English and Chinese marketing.",
  "predecessor/successor": "Part of ongoing The Monsters series.",
  "lateral_variants": "Let's Checkmate, Fall in Wild, other vinyl plush.",
  "same_sculpt/different_finish": "Similar vinyl plush format to other series.",
  "shared_collab_capsule": "None.",
  "series_hub_link": "POP MART The Monsters collection.",
  "official_price_history_timeline": "Launched at USD114.99/CAD134.99, reseller prices USD182–USD226.",
  "secondary_market_range_snapshots": "High secondary market demand at 60-98% markup.",
  "scarcity_signals": "Frequent sellouts, limited per-order quantities.",
  "https": "//www.popmart.com/ca/products/1371/the-monsters-flip-with-me-vinyl-plush-doll"
}