{
  "title": "PRONOUNCE — Wings of Fantasy (plush)",
  "release_date": "October 4, 2024.",
  "msrp_currency": "USD",
  "msrp": 119.99,
  "brand": "POP MART × Pronounce.",
  "line": "The Monsters.",
  "character": "Labubu.",
  "series": "Wings of Fantasy.",
  "variant_name": "Lavender fur with translucent butterfly wings, golden crown, star-patterned vest.",
  "form": "Vinyl plush doll.",
  "product_id": "SKU 1580",
  "size": "22×11×8 cm (including wings and crown).",
  "weight": "Unknown.",
  "materials": "Shell: 66% polyester, 25% PVC, 9% ABS; Stuffing: 95% polyester, 5% iron wire.",
  "finish": "Soft flocked plush with translucent vinyl wings.",
  "articulation": "Fixed figure.",
  "deltas": "None.",
  "date": "2024-10-04",
  "price": "USD 119.99",
  "body": "Identity \\& taxonomy:\nBrand: POP MART × Pronounce.\nLine: The Monsters.\nCharacter: Labubu.\nSeries: Wings of Fantasy.\nProduct title: LABUBU × PRONOUNCE – WINGS OF FANTASY Vinyl Plush Doll.\nVariant name: Lavender fur with translucent butterfly wings, golden crown, star-patterned vest.\nForm: Vinyl plush doll.\nDeterministic product_id components: SKU 1580.\nAliases \\& tokens: Wings of Fantasy Labubu, 时尚幻想之翼 (inferred).\nParent/child relations: Sequel to Be Fancy Now, paired with Wings of Fortune.\nPhysical spec:\nSize: 22×11×8 cm (including wings and crown).\nWeight: Unknown.\nMaterials: Shell: 66% polyester, 25% PVC, 9% ABS; Stuffing: 95% polyester, 5% iron wire.\nFinish: Soft flocked plush with translucent vinyl wings.\nArticulation: Fixed figure.\nAccessories: Translucent butterfly wings, golden crown.\nColorway notes: Pastel lavender with glitter accents.\nPackaging \\& in-box contents:\nPackaging type: Window display color box.\nPackaging dimensions \\& weight: 30×20×15 cm; gross weight ~0.5 kg.\nBox contents: Plush doll, authenticity card.\nAuthenticity marker: QR code sticker.\nFactory/QA code: Unknown.\nEdition \\& run info:\nEdition.kind: Collaboration limited edition.\nEdition size: Unknown.\nChase/rarity: Not blind box.\nPerks: VIP presale via Pronounce channels.\nCredits:\nOriginal designer/artist: Kasing Lung (龙家升).\nSculpt/model: POP MART design team.\nCollaboration partner: Pronounce.\nLicensing owner: POP MART \\& Pronounce.\nRelease \\& distribution:\nAnnounced date: September 28, 2024.\nRelease date: October 4, 2024.\nDrop windows: POP MART US, CA, EU, CN.\nPurchase limits: 2 per customer.\nMechanic: Online queue, in-store pick-up.\nRestock: None.\nSold out: Within 48 hours.\nRegional policy:\nRegion_lock: False.\nRegions: US, CA, CN, EU, APAC.\nDifferences: CE marking on EU boxes.\nMarket listings:\nRegion: US; Channel: POP MART US; MSRP: USD119.99.\nRegion: CA; Channel: POP MART CA; MSRP CAD149.99.\nStock status: Out of stock.\nPurchase limit: 2.\nBlind-box specifics:\nNot applicable.\nCompliance \\& safety:\nAge rating: Not for under 15.\nWarnings: Contains small parts.\nCompliance marks: CE.\nHS category: Unknown.\nCommerce \\& logistics:\nSKU: 1580.\nBarcode/EAN: 6972708011580 (inferred).\nShipping: Master carton 60×40×30 cm.\nReturn policy: 15-day returns.\nWarranty: None.\nMedia \\& assets:\nHero images: Doll front with wings.\nOrthographics: Angled shots highlighting wings.\nPackaging flats: Box art with Pronounce logo.\nVideos: Instagram reel [^7_1], TikTok demos.\nImage rights: POP MART \\& Pronounce.\nAsset hashes: Unknown.\nProvenance \\& research trace:\nPrimary: PopCultureDepot product page [^7_2], POP MART US [^7_3].\nSecondary: Instagram [^7_1][^7_4].\nRetrieved: 2025-08-13.\nDeltas: None.\nQueries: \"POP MART Wings of Fantasy plush 2024-10-04 USD 119.99\",\"POP MART Wings of Fantasy specifications\".\ni18n \\& nomenclature:\nLocalized titles: Wings of Fantasy 系列 (CN).\nTransliteration: Pronounce 品牌联名.\nRelations \\& graph edges:\nPredecessor: Be Fancy Now.\nSuccessor: Wings of Fortune.\nHub: Pronounce collaboration series.\nMarket intelligence (optional):\nPrice history: Launch USD119.99; resell USD200–USD250.\nSecondary market: USD180–USD240.\nScarcity: Sold out quickly, limited per-order.",
  "source": "COMPLETED SEEDS.txt",
  "product_title": "LABUBU × PRONOUNCE – WINGS OF FANTASY Vinyl Plush Doll.",
  "deterministic_product_id_components": "SKU 1580.",
  "aliases_\\&_tokens": "Wings of Fantasy Labubu, 时尚幻想之翼 (inferred).",
  "parent/child_relations": "Sequel to Be Fancy Now, paired with Wings of Fortune.",
  "accessories": "Translucent butterfly wings, golden crown.",
  "colorway_notes": "Pastel lavender with glitter accents.",
  "packaging_type": "Window display color box.",
  "packaging_dimensions_\\&_weight": "30×20×15 cm; gross weight ~0.5 kg.",
  "box_contents": "Plush doll, authenticity card.",
  "authenticity_marker": "QR code sticker.",
  "factory/qa_code": "Unknown.",
  "edition.kind": "Collaboration limited edition.",
  "edition_size": "Unknown.",
  "chase/rarity": "Not blind box.",
  "perks": "VIP presale via Pronounce channels.",
  "original_designer/artist": "Kasing Lung (龙家升).",
  "sculpt/model": "POP MART design team.",
  "collaboration_partner": "Pronounce.",
  "licensing_owner": "POP MART \\& Pronounce.",
  "announced_date": "September 28, 2024.",
  "drop_windows": "POP MART US, CA, EU, CN.",
  "purchase_limits": "2 per customer.",
  "mechanic": "Online queue, in-store pick-up.",
  "restock": "None.",
  "sold_out": "Within 48 hours.",
  "region_lock": "False.",
  "regions": "US, CA, CN, EU, APAC.",
  "differences": "CE marking on EU boxes.",
  "region": "CA; Channel: POP MART CA; MSRP CAD149.99.",
  "stock_status": "Out of stock.",
  "purchase_limit": "2.",
  "age_rating": "Not for under 15.",
  "warnings": "Contains small parts.",
  "compliance_marks": "CE.",
  "hs_category": "Unknown.",
  "sku": "1580.",
  "barcode/ean": "6972708011580 (inferred).",
  "shipping": "Master carton 60×40×30 cm.",
  "return_policy": "15-day returns.",
  "warranty": "None.",
  "hero_images": "Doll front with wings.",
  "orthographics": "Angled shots highlighting wings.",
  "packaging_flats": "Box art with Pronounce logo.",
  "videos": "Instagram reel [^7_1], TikTok demos.",
  "image_rights": "POP MART \\& Pronounce.",
  "asset_hashes": "Unknown.",
  "primary": "PopCultureDepot product page [^7_2], POP MART US [^7_3].",
  "secondary": "Instagram [^7_1][^7_4].",
  "retrieved": "2025-08-13.",
  "queries": "\"POP MART Wings of Fantasy plush 2024-10-04 USD 119.99\",\"POP MART Wings of Fantasy specifications\".",
  "localized_titles": "Wings of Fantasy 系列 (CN).",
  "transliteration": "Pronounce 品牌联名.",
  "predecessor": "Be Fancy Now.",
  "successor": "Wings of Fortune.",
  "hub": "Pronounce collaboration series.",
  "price_history": "Launch USD119.99; resell USD200–USD250.",
  "secondary_market": "USD180–USD240.",
  "scarcity": "Sold out quickly, limited per-order.",
  "Deltas": []
}