{
  "brand": "POP MART × Pronounce.",
  "line": "The Monsters.",
  "character": "Labubu.",
  "series": "Wings of Fortune.",
  "product_title": "LABUBU × PRONOUNCE – WINGS OF FORTUNE Vinyl Plush Hanging Card.",
  "variant_name": "Yellow fur with silver metallic wings, pearl crown, star motif.",
  "form": "Vinyl plush hanging card (pendant).",
  "product_code": null,
  "size_cm": "17.5×11×8 cm",
  "materials": "Shell: 66% polyester, 25% PVC, 9% ABS; Stuffing: 95% polyester, 5% iron wire.",
  "packaging_type": "Blister card with hanging peg.",
  "edition_kind": "Collaboration limited",
  "release_date": "2024-10-04",
  "msrp": 43.99,
  "currency": "USD",
  "url": "https://m.popmart.com/us/products/1580/labubu-%C3%97-pronounce-wings-of-fantasy-vinyl-plush-doll",
  "Deltas": [],
  "title": "PRONOUNCE — Wings of Fortune (hanging card)",
  "msrp_currency": "USD",
  "product_id": "SKU 675 (US) / SKU 1789 (alternate)",
  "size": "17.5×11×8 cm.",
  "weight": "Unknown.",
  "finish": "Soft plush with metallic vinyl wings.",
  "articulation": "Fixed.",
  "deltas": "None.",
  "date": "2024-10-04",
  "price": "USD 43.99",
  "body": "Identity \\& taxonomy:\nBrand: POP MART × Pronounce.\nLine: The Monsters.\nCharacter: Labubu.\nSeries: Wings of Fortune.\nProduct title: LABUBU × PRONOUNCE – WINGS OF FORTUNE Vinyl Plush Hanging Card.\nVariant name: Yellow fur with silver metallic wings, pearl crown, star motif.\nForm: Vinyl plush hanging card (pendant).\nDeterministic product_id components: SKU 1584.\nAliases \\& tokens: Wings of Fortune Labubu, 幸运之翼 (inferred).\nParent/child relations: Companion to Wings of Fantasy.\nPhysical spec:\nSize: 17.5×11×8 cm.\nWeight: Unknown.\nMaterials: Shell: 66% polyester, 25% PVC, 9% ABS; Stuffing: 95% polyester, 5% iron wire.\nFinish: Soft plush with metallic vinyl wings.\nArticulation: Fixed.\nAccessories: Hanging loop hardware.\nColorway notes: Pastel yellow with silver accents.\nPackaging \\& in-box contents:\nPackaging type: Blister card with hanging peg.\nDimensions \\& weight: 20×12×9 cm; gross weight ~0.2 kg.\nBox contents: Hanging card figure, authenticity sticker.\nMarker: QR code on backing card.\nFactory/QA code: Unknown.\nEdition \\& run info:\nEdition.kind: Collaboration limited.\nEdition size: Unknown.\nChase/rarity: Not blind box.\nPerks: None.\nCredits:\nDesigner/artist: Kasing Lung (龙家升).\nSculpt/model: POP MART design team.\nCollaboration: Pronounce.\nLicense: POP MART \\& Pronounce.\nRelease \\& distribution:\nAnnounced: September 28, 2024.\nRelease: October 4, 2024.\nChannels: POP MART US, global.\nPurchase limits: 2 per customer.\nMechanic: Online sale.\nRestock: None.\nSold out: Within 48 hours.\nRegional policy:\nRegion_lock: False.\nRegions: Global.\nDifferences: EU CE marking.\nMarket listings:\nRegion: US; Channel: POP MART US; MSRP: USD43.99.\nStock status: Out of stock.\nPurchase limit: 2.\nBlind-box specifics:\nNot applicable.\nCompliance \\& safety:\nAge: 15+.\nWarnings: Contains small parts.\nCompliance: CE.\nHS category: Unknown.\nCommerce \\& logistics:\nSKU: 1584.\nBarcode: 6972708011584 (inferred).\nShipping: Bulk pegs per carton.\nReturns: 15-day.\nWarranty: None.\nMedia \\& assets:\nHero image: Pendant on backing card.\nOrthographics: Front, back of card.\nPackaging flats: Backing card art.\nVideos: LittleThings listing [^7_5].\nRights: POP MART \\& Pronounce.\nProvenance \\& research trace:\nPrimary: LittleThings product page [^7_5], POP MART US [^7_6].\nSecondary: Instagram [^7_1][^7_7].\nRetrieved: 2025-08-13.\nDeltas: None.\nQueries: \"POP MART Wings of Fortune hanging card specifications\",\"POP MART Wings of Fortune price USD43.99\".\ni18n \\& nomenclature:\nLocalized title: Wings of Fortune 挂卡 (CN).\nTransliteration: 幸运之翼.\nRelations \\& graph edges:\nCompanion: Wings of Fantasy plush.\nHub: Pronounce collaboration.\nMarket intelligence (optional):\nPrice history: Launch USD43.99; resell USD75–USD90.\nSecondary market: USD65–USD85.\nScarcity: Limited sale, immediate sellout.\nProvenance URLs:\nhttps://m.popmart.com/us/products/1580/labubu-×-pronounce-wings-of-fantasy-vinyl-plush-doll\nhttps://www.popculturedepot.com/products/labubu-pronounce-wings-of-fortune-vinyl-plush-hanging-card-1\nhttps://littlethingsme.com/products/labubu-pronounce-wings-of-fortune-vinyl-plush-hanging-card\nhttps://www.instagram.com/reel/DAd3tCeJZLQ/?hl=en\nhttps://www.popmart.com/en-HK/products/1153/labubu-×-pronounce-wings-of-fortune-vinyl-plush-hanging-card\nUPDATED CURRENT QUEUE\nCoca-Cola — 2025-01-24; 15.5×17 cm; set USD 239.94 / box USD 39.99 (blind box)\nExciting Macaron (v1) — 2024-10-27; set USD 131.94 / box USD 21.99\nHave a Seat — 2024-07-12; 8×7×15 cm; set USD 131.94 / box USD 21.99\nBig Into Energy (v3) — 2025-04-25; 17 cm; set USD 167.94 / box USD 27.99\nI FOUND YOU (v1) — 2023-12-15; 30×25×58 cm; USD 179.99\nANGEL IN CLOUDS (v2) — 2024-10-25; 33×25×58 cm; USD 289.99\nClose to Sweet (v1) — 2023-09-xx; plush vs pendant (split by form)\nFall into Spring — 2024-03-08; CNY 599 (plush) / CNY 159 (pendant)\nBlue Diamond — 2024-06-18; CNY 159 (pendant)\nMagic of Pumpkin (Halloween) — 2024-10-27; CNY 159 (pendant)\nTwinkly Fairy Tale — 2024-11-28; CNY 159 (pendant)\nHide and Seek in Singapore — S\\$ 37.90; 10×10×17.5 cm; reg-sg expected\nGOOD LUCKY TO YOU (Thailand) — THB 1,050; 2024-12-20; reg-th expected\nForest Fairy Tale (China) — 2025-05-26; member points; reg-cn expected\nWacky Mart (China) — 2025-06-12; CNY 199; reg-cn expected\n<div style=\"text-align: center\">⁂</div>\nCOMPLETED SEEDS",
  "source": "COMPLETED SEEDS.txt",
  "deterministic_product_id_components": "SKU 1584.",
  "aliases_\\&_tokens": "Wings of Fortune Labubu, 幸运之翼 (inferred).",
  "parent/child_relations": "Companion to Wings of Fantasy.",
  "accessories": "Hanging loop hardware.",
  "colorway_notes": "Pastel yellow with silver accents.",
  "dimensions_\\&_weight": "20×12×9 cm; gross weight ~0.2 kg.",
  "box_contents": "Hanging card figure, authenticity sticker.",
  "marker": "QR code on backing card.",
  "factory/qa_code": "Unknown.",
  "edition.kind": "Collaboration limited.",
  "edition_size": "Unknown.",
  "chase/rarity": "Not blind box.",
  "perks": "None.",
  "designer/artist": "Kasing Lung (龙家升).",
  "sculpt/model": "POP MART design team.",
  "collaboration": "Pronounce.",
  "license": "POP MART \\& Pronounce.",
  "announced": "September 28, 2024.",
  "release": "October 4, 2024.",
  "channels": "POP MART US, global.",
  "purchase_limits": "2 per customer.",
  "mechanic": "Online sale.",
  "restock": "None.",
  "sold_out": "Within 48 hours.",
  "region_lock": "False.",
  "regions": "Global.",
  "differences": "EU CE marking.",
  "region": "US; Channel: POP MART US; MSRP: USD43.99.",
  "stock_status": "Out of stock.",
  "purchase_limit": "2.",
  "age": "15+.",
  "warnings": "Contains small parts.",
  "compliance": "CE.",
  "hs_category": "Unknown.",
  "sku": "1584.",
  "barcode": "6972708011584 (inferred).",
  "shipping": "Bulk pegs per carton.",
  "returns": "15-day.",
  "warranty": "None.",
  "hero_image": "Pendant on backing card.",
  "orthographics": "Front, back of card.",
  "packaging_flats": "Backing card art.",
  "videos": "LittleThings listing [^7_5].",
  "rights": "POP MART \\& Pronounce.",
  "primary": "LittleThings product page [^7_5], POP MART US [^7_6].",
  "secondary": "Instagram [^7_1][^7_7].",
  "retrieved": "2025-08-13.",
  "queries": "\"POP MART Wings of Fortune hanging card specifications\",\"POP MART Wings of Fortune price USD43.99\".",
  "localized_title": "Wings of Fortune 挂卡 (CN).",
  "transliteration": "幸运之翼.",
  "companion": "Wings of Fantasy plush.",
  "hub": "Pronounce collaboration.",
  "price_history": "Launch USD43.99; resell USD75–USD90.",
  "secondary_market": "USD65–USD85.",
  "scarcity": "Limited sale, immediate sellout.",
  "https": "//www.popmart.com/en-HK/products/1153/labubu-×-pronounce-wings-of-fortune-vinyl-plush-hanging-card",
  "<div_style=\"text-align": "center\">⁂</div>"
}